sample_id,image_path,source_image_url,text,raw_order
1rugmjt,images_jpg/1rugmjt.jpg,https://preview.redd.it/h806pi2y68pg1.jpeg?auto=webp&s=6e4d850172965086cf9ed84ce1584dadc5cf91dc,I don’t blame him it’s literally lebron,252
1ruxcqo,images_jpg/1ruxcqo.jpg,https://preview.redd.it/z2ekn2qlibpg1.png?auto=webp&s=8fce6f19ec0300c466f9e3c8c8fa5dd98735dabf,I thought Jordan played 15 seasons,253
1ru4bpn,images_jpg/1ru4bpn.jpg,https://external-preview.redd.it/YWRwemk0MnZ2NHBnMcFxqwzZ0lwL19_6oc0U1TOKGrT1gXMeckF90VIqVORW.png?format=pjpg&auto=webp&s=eb4152809c557c4db539e64994f85c5ae9dc4764,Luka post game tonight,254
1rtwcs4,images_jpg/1rtwcs4.jpg,https://external-preview.redd.it/eDloa3FsZnUyM3BnMTf_zLXGj9DtzbdSG2b65Kb7t0fIgmfdsas7TPk6a0m8.png?format=pjpg&auto=webp&s=5e32096cad29ea47c83b2ed34a5ddd870bbcd150,Steph moving like this at 8 years old is crazy!,255
1ru3e0p,images_jpg/1ru3e0p.jpg,https://preview.redd.it/40okekx1l4pg1.jpeg?auto=webp&s=7eb3731a80375e13bae7630c19f6ceb6592925be,"""Fuck that thinner air in Denver. There’s about 15–20% less oxygen per breath there than at sea level. Shit's dangerous."" - Joel Embiid",256
1ru0qeo,images_jpg/1ru0qeo.jpg,https://preview.redd.it/v7821edq04pg1.jpeg?auto=webp&s=33acb13da0b42855ccacb88b7c8c45a7a0c6902f,😂😂😂,257
1rulfry,images_jpg/1rulfry.jpg,https://preview.redd.it/xzkj4qho39pg1.png?auto=webp&s=61754371cbeca31af0f3361e3adaa89ebb37d91a,Legendary Recommended Pull,258
1ru33ee,images_jpg/1ru33ee.jpg,https://external-preview.redd.it/MTF0bHZvbXNrNHBnMQH1DsYmgK4x4NsX_x-lMBiNEZGzY-igYQkLej_mM6h1.png?format=pjpg&auto=webp&s=b9d5d60789c76a972cd6cd44130a0f8ad5c88b88,Doc Rivers reacts to Kyle Kuzma's incredible pass,259
1ru59d9,images_jpg/1ru59d9.jpg,https://preview.redd.it/vd8dih2v45pg1.jpeg?auto=webp&s=1bbd506361cff88396af3020bc0be82abeb259c2,"No sign of Jamal Jordan vs. the Lakers tonight.
Jamal finished with 5 points on 1-for-14 shooting and fouled out as the Nuggets fell to the Lakers in OT.",260
1rubng9,images_jpg/1rubng9.jpg,https://preview.redd.it/qt9bm03127pg1.jpeg?auto=webp&s=019d595590adecb9c064dafb41f12d2dfa8acb67,"I'll be there when you're hurt, LeBoo",261
1rtnl21,images_jpg/1rtnl21.jpg,https://external-preview.redd.it/bWdwZXZzcGdkMXBnMdLzNtSkxbTNIZShT_u8idvR-BvB5MwtJUoid0ptsLHJ.png?format=pjpg&auto=webp&s=cbd9880985451928abe240246346f2f3ee199aad,"Throwback to Cade Cunningham's Instagram live
He never went live again 😂..........................................................................",262
1rttqqn,images_jpg/1rttqqn.jpg,https://preview.redd.it/nufh9w86k2pg1.jpeg?auto=webp&s=10e481eea3265b0d2ed8568dc80ad892e9c2e4d3,Alien,263
1rudpfq,images_jpg/1rudpfq.jpg,https://preview.redd.it/feemo3wzk7pg1.jpeg?auto=webp&s=d7bbc5c8cdac43eb6bb34d397ecce015196d20b5,Let’s not talk about that 5 second inbound violation either…,264
1rtn68f,images_jpg/1rtn68f.jpg,https://external-preview.redd.it/eXVwbXJlcWlhMXBnMa_wlTcfwvUKZLWfJI0Q752mjIflk8DaqHuBMpgFn9HH.png?format=pjpg&auto=webp&s=cf0547c541c7b40245a7f6b9da50ea6404cc0757,Blake Griffin doing the Kawhi laugh,265
1rtu3gc,images_jpg/1rtu3gc.jpg,https://preview.redd.it/qadsjocom2pg1.png?auto=webp&s=417a6500eadd623f1645d42f4eae648748e9cb67,Sometimes it be like that,266
1rt2znc,images_jpg/1rt2znc.jpg,https://preview.redd.it/jk95bnaaawog1.jpeg?auto=webp&s=d3d8cdd3786471efd4e0e2be628db04293821e43,SGA and them damn shades man,267
1rtb05z,images_jpg/1rtb05z.jpg,https://preview.redd.it/rhu4c7zt4yog1.jpeg?auto=webp&s=326e79be874d8d5708c57a043c65c044827833fc,IT’S OFFICIAL: Josh Giddey is better than Michael Jordan.,268
1rtiigm,images_jpg/1rtiigm.jpg,https://preview.redd.it/kicms7f6b0pg1.png?auto=webp&s=8ae984f68a8b5dda09d5dbe79d0f8001b142a1bb,Trae Young witnessed history... just on the wrong side,269
1run05t,images_jpg/1run05t.jpg,https://preview.redd.it/dvne3rlie9pg1.jpeg?auto=webp&s=67fd3dafdfe08f29dd01fbed0b49b161c429c592,Who ya got?,270
1rt40uj,images_jpg/1rt40uj.jpg,https://preview.redd.it/hiks6onuhwog1.png?auto=webp&s=ea899bc7a00791d520756fcfeaa969a5f40a45fd,Trae Young is the ultimate Good Luck Charm... for the other team,271
1rtaocv,images_jpg/1rtaocv.jpg,https://preview.redd.it/cank1h9l1yog1.jpeg?auto=webp&s=f31097fbc3c2d32fc20cda740a8f028779b480aa,Next stop for Kerr,272
1rsm0a4,images_jpg/1rsm0a4.jpg,https://preview.redd.it/9pyycrvd3tog1.jpeg?auto=webp&s=a8aaaec986aedc8f2654ebe4442e799f7d8d401c,"""I just don't think that's basketball""
If you lost the game, just accept that you lost the game. Complaining about baiting when you were flopping just as much, if not more (4th quarter) than your MVP rival is just silly.",273
1rs8he3,images_jpg/1rs8he3.jpg,https://preview.redd.it/ehkght76jpog1.jpeg?auto=webp&s=797185dafc9e12f21406585f3e8f672ca65cf909,Goddammit,274
1rsqw5h,images_jpg/1rsqw5h.jpg,https://preview.redd.it/shd8ov4h2uog1.png?auto=webp&s=097cf182cdbc7e345c508e6d3c08371b32100aa2,Dejounte Murray with the most disrespectful crossover,275
1ru7k0v,images_jpg/1ru7k0v.jpg,https://preview.redd.it/fivnf6cqs5pg1.png?auto=webp&s=e04e122e8b83ca85a27db3733d7aafa66ad0630a,The Lakers finally got the W,276
1rstcfu,images_jpg/1rstcfu.jpg,https://preview.redd.it/y15rrt16iuog1.jpeg?auto=webp&s=569a1b6f44904ac232689c120a4a849dc8d1201c,"""let bam score 83 so he stops complaining about dpoy""                                       ""yes sir commissioner silver""",277
1rsprk6,images_jpg/1rsprk6.jpg,https://external-preview.redd.it/MWRkcnN6NHh1dG9nMWTC2PLwn3orBXcL2XbTwWcqf52JOv-FKQZJm7dz7_iJ.png?format=pjpg&auto=webp&s=819a7e39a5bb77af0c9dcb9330e33b8d035a2ddd,Bam’s 83 point game inspiring the Nuns to get it done! 🏀😅,278
1rtb0tn,images_jpg/1rtb0tn.jpg,https://preview.redd.it/18x1jfm05yog1.jpeg?auto=webp&s=3456f424a18faf8cea4a362bea625a1cea95e6d6,"Just trying to ride out the clock I guess
This was after a very long segment where John Wall listed colleges. Blake Griffin is now putting to use up the rest of the air time.",279
1rsvem6,images_jpg/1rsvem6.jpg,https://preview.redd.it/xga9kk53vuog1.png?auto=webp&s=7d739f72ab04abc3c453fc72d99882ea9699b98f,"In light of yesterday’s collision between the referee and the camera, Adam Silver has instructed media outlets to implement additional safety measures for equipment positioned near courtside.",280
1rscuq4,images_jpg/1rscuq4.jpg,https://external-preview.redd.it/MTE1Y3BnMTJpcW9nMRzsOo3PHFe9cPm-W92Z_HqXlKnYq1jzeiN9TfjPtif6.png?format=pjpg&auto=webp&s=cd9dbb60dcb178e5fbfe05af0cefe12478bb5ef8,Most passionate horsemen,281
1rsihak,images_jpg/1rsihak.jpg,https://preview.redd.it/6qbemuk55sog1.png?auto=webp&s=bbb927b99b918466835b65e91399053904e8bf97,Same energy,282
1rs2bvh,images_jpg/1rs2bvh.jpg,https://preview.redd.it/l59ofqducoog1.jpeg?auto=webp&s=9a567ba21b2750013fde6ee80b888dce8d504b91,83 points is 83 points. It’s forever set in stone.,283
1rs5o8m,images_jpg/1rs5o8m.jpg,https://preview.redd.it/65g5js11zoog1.jpeg?auto=webp&s=e6b7be2413b51291daa5d527df81a30f4b36289a,Kobe fans aren’t real 😭😭😭,284
1rsdj0p,images_jpg/1rsdj0p.jpg,https://external-preview.redd.it/cXZzNWd3Y2pvcW9nMTSwHmOBuj-67bBKoD4FZ3OKFmFceOiJVaGVZbVJi_e2.png?format=pjpg&auto=webp&s=8d296d0ffeaa969d5b48d79521bfceaed096630f,Ayoooo what’s going on in Orlando?,285
1rrkh5o,images_jpg/1rrkh5o.jpg,https://preview.redd.it/v6r15d3sjkog1.png?auto=webp&s=e9107afb5a1201d96fb54610385e6bb654524456,Steve Kerr would bench Bam after he scored 31 in the 1st quarter,286
1rsb28u,images_jpg/1rsb28u.jpg,https://preview.redd.it/fjw1bh8c3qog1.gif?format=png8&s=de8e30832d51d5bb15e01e1693104b2f7d783143,Eight Straight Hawks Wins !!!!!!!!,287
1rrycgh,images_jpg/1rrycgh.jpg,https://preview.redd.it/e7ts1255nnog1.jpeg?auto=webp&s=9b82c770ea958a503067eac6b313493e438620dc,I still can't believe it,288
1rrvpry,images_jpg/1rrvpry.jpg,https://external-preview.redd.it/OXU0bnFnd202bm9nMR5FHEXdqnVqOq5O41CyC7ex9WIb_OYJaRqKY9dT45QC.png?format=pjpg&auto=webp&s=2f01a9d098020e29c678877355a88ff9d958746d,A fight made Kawhi smile,289
1rrio0n,images_jpg/1rrio0n.jpg,https://preview.redd.it/klttk9550kog1.jpeg?auto=webp&s=d5de089ab68585bfb358ef588669e011c57238cd,The hell is this,290
1rrwryg,images_jpg/1rrwryg.jpg,https://preview.redd.it/lkpopllddnog1.jpeg?auto=webp&s=0666eba5d08e3cc727315161d011dad2fecbfb9b,Thought of this and had to make it,291
1rqwt51,images_jpg/1rqwt51.jpg,https://preview.redd.it/h4wdln81pfog1.jpeg?auto=webp&s=be291ccdf4759939f45620150c2446d90d4da773,lol,292
1rsil6d,images_jpg/1rsil6d.jpg,https://preview.redd.it/uf9b2zqt4sog1.jpeg?auto=webp&s=742a9e2c065b77b87d291aba89ee6957d0aa8dba,"Chris Paul as an NBA referee
Would you like to see him as an NBA referee? You think he would be fair, or would do a better job? Or you would just like to see it for the funsies?

If not him, who other NBA player would you like to be a referee?",293
1rrh68k,images_jpg/1rrh68k.jpg,https://preview.redd.it/pi4ipbahljog1.jpeg?auto=webp&s=947341ac4b3b1cfbccdcae51d2e05ee0e8d6aa52,Suddenly 47% field goal percentage is bad to lakers fans,294
1rrveg1,images_jpg/1rrveg1.jpg,https://external-preview.redd.it/ODRrNWl0Y200bm9nMSBN6tWNdJVdFRn5YtINN9XdQRc93XkFNGLGIPr1hxtG.png?format=pjpg&auto=webp&s=a24c93c4bebe93b915ba228c1e94e0fbfc558480,It gets to a point,295
1rrd251,images_jpg/1rrd251.jpg,https://preview.redd.it/3qhhep6mniog1.jpeg?auto=webp&s=708b4341b73e44ffaf745223edfbaeeb62becf81,"I’ve been offline a couple days and come back to Bam Margera scoring 83 points!?
Damn I mean good for him though, it’s really cool to see sobriety going so well for him. But isn’t he only like 5’8?",296
1rr82tp,images_jpg/1rr82tp.jpg,https://preview.redd.it/4p7a73qjohog1.jpeg?auto=webp&s=00ebad926d6f2e1d03320e5f89c59063695b2e86,Why didn't Bam do this? Is he stupid?,297
1rqxe0j,images_jpg/1rqxe0j.jpg,https://preview.redd.it/odasf3dxsfog1.png?auto=webp&s=78cd095a6de0ec611bc38626f38fa785ae00bd4f,Generational Whistle,298
1rqzrr9,images_jpg/1rqzrr9.jpg,https://preview.redd.it/m1ofrbq18gog1.jpeg?auto=webp&s=971c575dd8a9e81e7858dc6290188d6739b5de6c,I just hope all of Bam’s victims will get justice.,299
1rqhmbl,images_jpg/1rqhmbl.jpg,https://preview.redd.it/xurpkb86vbog1.jpeg?auto=webp&s=83993051926c63964b7aa738fc85829cecd34c1a,Bam's performance tn gives this vibe,300
1rqyq80,images_jpg/1rqyq80.jpg,https://preview.redd.it/mcko8vvj1gog1.jpeg?auto=webp&s=b960d8715fef5259d2d5b8f0717811b677d67217,Matas had a career high 41 PTS… And nobody cares 😩,301
1rqh75h,images_jpg/1rqh75h.jpg,https://preview.redd.it/474qu00urbog1.jpeg?auto=webp&s=9d7d5bf1eab0a99abc3a2891a0fc24d2d91b3214,Bam Adebayo just single handily moved Kobe down a few spots on the all time great list,302
1rqbem5,images_jpg/1rqbem5.jpg,https://preview.redd.it/o1ty9euilaog1.jpeg?auto=webp&s=8c5982a1cac94f30f96ed4b4d960618e2e8bf781,The internet always wins,303
1rqhod0,images_jpg/1rqhod0.jpg,https://preview.redd.it/seca85bmvbog1.jpeg?auto=webp&s=4c888b671dd109379c85c295b03c7ae86fe5fda0,Bam was just 11 points away from having the highest scoring game in the 2000s,304
1rqipag,images_jpg/1rqipag.jpg,https://preview.redd.it/dctu3ag24cog1.jpeg?auto=webp&s=c27ab0f693a201aaa6ebc7672c5198cb1fd2c7c2,"SGA seeing the Wizards let Bam attempt 43 FTs in a game
Not sure if OKC still has to play Washington but I bet there is a big red circle on SGA's calendar if they do.",305
1rqtxhf,images_jpg/1rqtxhf.jpg,https://preview.redd.it/1vpglxhe5fog1.jpeg?auto=webp&s=44dfdb9810231d8511629ef027b0eb84f73b7aa9,He went nuclear on 'em,306
1rrs4qa,images_jpg/1rrs4qa.jpg,https://external-preview.redd.it/BhSfC5PFwRNwzsRhaVCB_BXfNhbiADP3CUcqXMCVZfw.jpeg?auto=webp&s=3d5d1742b1b61d28f803b4e76bcabbc90b1311b1,How kids in 2040 about to be,307
1rqhz5q,images_jpg/1rqhz5q.jpg,https://preview.redd.it/zmfu6i20ybog1.png?auto=webp&s=0c8d91fda3b8742106f1e42a71e1ce5c5196c3a2,I just had a feeling,308
1rqix5l,images_jpg/1rqix5l.jpg,https://preview.redd.it/gtjficdh5cog1.jpeg?auto=webp&s=d1d97eeb5e4a0971941493acd0d5c49799228924,"Moments before Historical Disaster
Oh Boy Im so excited to travel to Miami and see my hometown team play. Maybe we might be able to make a comeback in the second half and win a game. Congrats Bam.",309
1rr0hpt,images_jpg/1rr0hpt.jpg,https://external-preview.redd.it/YW9vYWg2aWhjZ29nMTuPsE9T3OpzIRg2IH1qATFNu0U6vgTBYulk-I5txCwT.png?format=pjpg&auto=webp&s=a6dc400bf2cb932c34dfdace0a39ef904dc5b91a,The entire NBA when a player not named LeBron has one of the greatest individual performances of all time,310
1rql8wk,images_jpg/1rql8wk.jpg,https://preview.redd.it/gzdqiug2rcog1.gif?format=png8&s=e0d8ef8189efa9ff4217e6e909a9a45b5814083f,Kobe RN,311
1rr1gd2,images_jpg/1rr1gd2.jpg,https://preview.redd.it/9f2vt8egigog1.jpeg?auto=webp&s=45be279c516c59f863c8719f99aa5b2f7e54d801,"Hottest in the NBA!!!!!!! Seven Straight Hox Wins!
AH AH AH AH AH AH AH AH",312
1rqhmc6,images_jpg/1rqhmc6.jpg,https://preview.redd.it/yixxsgj6vbog1.jpeg?auto=webp&s=a22190ccddd1290bbb9e798542e310702c8a595e,Bam Adebayo in the hall of fame between Kobe and Wilt,313
1rqkesn,images_jpg/1rqkesn.jpg,https://preview.redd.it/sr6bguo7jcog1.jpeg?auto=webp&s=d138cd46b42e58416cf55a868c6ebfbd3378e604,3rd place now,314
1rqhlaf,images_jpg/1rqhlaf.jpg,https://external-preview.redd.it/NXprazg4bnh1Ym9nMdkdfYjw3q0tR4xj6qo7NbBZ8n6ygfkqqna15f0VMOgQ.png?format=pjpg&auto=webp&s=992ee3ae7e214f567ed6522da7194aedba47db75,Bro exaggerated when he know he is on camera,315
1rqfc0r,images_jpg/1rqfc0r.jpg,https://preview.redd.it/0bnplitadbog1.png?auto=webp&s=cd8859449e83ce2455f5aeacc786bf58b231ca89,Jaylen Brown realizing his hopes for an MVP is over and the Tatum documentary hasn't even dropped yet.,316
1rqhd2e,images_jpg/1rqhd2e.jpg,https://preview.redd.it/3tgg8ci4tbog1.jpeg?auto=webp&s=58a2182ebf3ec3ea7effccaed0e854b668059162,Lebron knew,317
1rqh2yc,images_jpg/1rqh2yc.jpg,https://preview.redd.it/ge2dw32xqbog1.jpeg?auto=webp&s=22e1be39d01d03149cadeb2ec9406833aef944ef,I wonder what LeCap will have to say about Bam’s performance tonight,318
1rqdvnb,images_jpg/1rqdvnb.jpg,https://preview.redd.it/3ac94fge2bog1.png?auto=webp&s=c20f3cab820dbb8fa089bb27e08f7dc36d4fb891,What's the best NBA meme of all time?,319
1rq82rr,images_jpg/1rq82rr.jpg,https://preview.redd.it/pyq9rwnvz9og1.jpeg?auto=webp&s=5d241d6402df9f1e33c61b6c4d4ee7279041419a,Just a picture of Luka and the Lakers,320
1rpy72w,images_jpg/1rpy72w.jpg,https://preview.redd.it/oa2zsw3y78og1.png?auto=webp&s=2faa90a4baaa568e4b673055a15d35d04e4ac515,"This is why people hate Thunder defense. Jaylin Williams knows he can't block this shot with Murray in the way. Instead of accepting that, he bulldozes Murray, hoping the foul gets called prior to the shot.",321
1rqil94,images_jpg/1rqil94.jpg,https://preview.redd.it/bp1kqkh82cog1.jpeg?auto=webp&s=2ac4f587e3b9394ff1b98a8dcd8c69167bf316af,"I think I might be the NBA fan equivalent of bad luck Brian. (Congrats Bam).
Super fan Travels to Miami hoping to see his hometown team play.  Sees historic game where bam drops 83 points on their Heads.",322
1rr1bxt,images_jpg/1rr1bxt.jpg,https://preview.redd.it/8n1fx5aohgog1.gif?format=png8&s=7b23e1fd6f5a6ec8f1c63eb6a924bd2b2c41ddb1,That’s Seven Straight Hawks Wins!!!Ah Ah Ah Ah Ah Ah Ah!!!!!!!,323
1rpjj2q,images_jpg/1rpjj2q.jpg,https://preview.redd.it/7aihz5auf4og1.png?auto=webp&s=4675c3dbc68d8945dddc56e67f3ebb7b2d170391,This might genuinely be the worst fit any NBA player has ever worn 😭,324
1rqmu02,images_jpg/1rqmu02.jpg,https://preview.redd.it/0hiprbq08dog1.png?auto=webp&s=37fc1b7839ece7baac44c50b87aa94d8c3708bd4,Look at Shai man,325
1rqka0p,images_jpg/1rqka0p.jpg,https://external-preview.redd.it/dzdyYzIxdGFoY29nMdWpd-NTs5UiOXWukvJEVVIbRQWI-jiGkK0lz-iZbrAK.png?format=pjpg&auto=webp&s=5f5d0b348971b67d6c494e1e965e61a1d8cd0262,"Brandin Podziemski gave Jazz fans free chickens and a dub tonight.

Bro deserves a statue outside Delta Center for this 😭",326
1rqhokn,images_jpg/1rqhokn.jpg,https://preview.redd.it/zxkvnfjjvbog1.png?auto=webp&s=7f2712bbe00934fab7bf812cb57b62596cf1152a,"Welcome to the GOAT Debate, Bam Adebayo!
The best part is I just watched the newest Jxmmy Highroller video about why it's impossible to score 100 points in today's NBA",327
1rqi9z3,images_jpg/1rqi9z3.jpg,https://external-preview.redd.it/OWNxaHpzNWkwY29nMbwliePDqZXPK46VsKCujvWaEQQtEhrXgIPD-pfEFpX8.png?format=pjpg&auto=webp&s=84bf318606408582f8d55ee6671db509d283d4c4,Kelel ware making a whole lotta sense now,328
1rqyyc0,images_jpg/1rqyyc0.jpg,https://preview.redd.it/sz8kmhwx2gog1.png?auto=webp&s=b98a351d0c852df351c340424e2db45d1ec81f63,Do you think Bam has discovered the true nature of being a NBA player after his 83 point explosion?,329
1rpun6d,images_jpg/1rpun6d.jpg,https://preview.redd.it/ae1o9j9dg7og1.jpeg?auto=webp&s=dfd7b8c9b1af9b9fec4d71b5715c47d5cf4ee74e,Does Wiggins deserve to have his nickname snatched like Carmelo 🤔?,330
1rq5rki,images_jpg/1rq5rki.jpg,https://preview.redd.it/uqmzw4xcl9og1.jpeg?auto=webp&s=b6b07f93b6c42bcfc82dd25fddd0d2d2e6bd3e0b,"Adam Silver announces Atlantas “Magic City Night” will be replaced with MMA night where Isiah Stewart will fight Musa Diabate
“We saw the card set to go down at the White House and just had to respond in kind with a spectacle of our own.”",331
1rqisue,images_jpg/1rqisue.jpg,https://preview.redd.it/kr8f6okx4cog1.jpeg?auto=webp&s=dbd241a68253dea67731666cd5887964db528634,"Trae Young had to see 73 and 83 on his teams
Trae Young two years ago had Luka put 73 points on his team the same guy he got traded for: 

https://www.espn.com/nba/game/\_/gameId/401585262/mavericks-hawks

Fast forward today where Trae young is injured but Bam scored 83 on his team 

https://www.espn.com/nba/recap/\_/gameId/401810793

Might be cursed or something",332
1rpxi2v,images_jpg/1rpxi2v.jpg,https://preview.redd.it/qo39w3f138og1.png?auto=webp&s=b6bb655ee8242463b2d18bd249e645fb50c69db0,"I figured out how SGA does it
If you know how officiating works, you know there's a seniority. At every game, there's a senior level ref who the other refs will defer to. SGA knows where that ref is at all times and makes sure that he can't see whether or not there was contact. So on this play in the 1st, he knows the ref behind him is not a rookie ref and therefore is expected to make calls himself (not defer). He also knows to angle his body so the ref can't tell whether or not it's a flop. (it is)....",333
1rqhlr6,images_jpg/1rqhlr6.jpg,https://preview.redd.it/durewafzubog1.png?auto=webp&s=71efb0588c16224268294b41f193e81243657276,The 2025-26 Detroit Pistons might be the 2015 Atlanta Hawks reincarnated,334
1rqpype,images_jpg/1rqpype.jpg,https://preview.redd.it/y2kr7ubq6eog1.png?auto=webp&s=8058f40de30bdfd52ffe01cb7827e5f60f8bca0f,King of comedy,335
1rqh6nt,images_jpg/1rqh6nt.jpg,https://preview.redd.it/6uvsj87qrbog1.jpeg?auto=webp&s=07c170d6495ed472976791f3523d6bff2292e0db,How the wizards were guarding Bam near the end😂,336
1rqhe8n,images_jpg/1rqhe8n.jpg,https://preview.redd.it/73r7jfrdtbog1.jpeg?auto=webp&s=ab5728ed245457c455c1631073540a2598135c03,Bam Adebayo against the wizards,337
1rpimbv,images_jpg/1rpimbv.jpg,https://external-preview.redd.it/d2FxOXA0c3Q4NG9nMSefXc7qFI_tMg6ME9AKwPxzfeygOvqbVmNpIfMVR4i9.png?format=pjpg&auto=webp&s=1a30548152e3157156eba4db61bcb8e0a4443fb1,"KD is not gonna stay
Nearly crashed out right there lmfao. That groupchat is gonna be lit. You almost feel bad for his teammates.",338
1rreqxg,images_jpg/1rreqxg.jpg,https://preview.redd.it/jvdjn91f0jog1.png?auto=webp&s=bd7acb6a080def1ce239c5202b8e828ba1623185,Shai had both the first and last laugh,339
1rqmoae,images_jpg/1rqmoae.jpg,https://preview.redd.it/5qmtianf6dog1.jpeg?auto=webp&s=be0f26fc77d03dffe19482077cbd5c2eb7b1ec4e,I’m tired Sam….,340
1rpi0ey,images_jpg/1rpi0ey.jpg,https://preview.redd.it/j0ktsiva44og1.png?auto=webp&s=5c4a5dee37e438a642189709f4f16c7056f72266,Jokic 100% wore this fit on purpose 😂,341
1rq10xh,images_jpg/1rq10xh.jpg,https://external-preview.redd.it/OHNpYm9ybGFyOG9nMWgHI1-IPa7Rz-d1rE2dRmc5WEldlIsLl89x7zCdBFDx.png?format=pjpg&auto=webp&s=8e93b405991e835c425d4e9ae3762d2085aca1de,Holy Sh*t - Lebron is a real Goat,342
1rr6nf0,images_jpg/1rr6nf0.jpg,https://preview.redd.it/znyj04m7fhog1.jpeg?auto=webp&s=4358b20654c7fd2a0a0885346db36195b976ee5b,"""I love basketball. What's wrong with shooting below average from the floor and getting 43 FT's? STOP HATING!""",343
1rqi952,images_jpg/1rqi952.jpg,https://external-preview.redd.it/dTBoOXRmbTYwY29nMX7xKt9xqQ_cTuKTNG94NG4MIWkQzsXz6MdrUJdYL25L.png?format=pjpg&auto=webp&s=1369dca9e08b4b4d31aa4dfb65808b54f57172e1,Maybe Kel'el Ware was lwk here after the game,344
1rpk1a4,images_jpg/1rpk1a4.jpg,https://preview.redd.it/l4pkp73uj4og1.png?auto=webp&s=bf5869a332e5d8d7ab1c323a6b4f99d6a97be614,The NBA really makes no sense sometimes,345
1rq9is9,images_jpg/1rq9is9.jpg,https://external-preview.redd.it/cXMyOXFsODM5YW9nMeOwxEKY_BwUmvv0yJlvuSQnrkHkZJuTTKSVmRt4UrhV.png?format=pjpg&auto=webp&s=5da1ecbf4d6a724128134adab24fd741d5bdca99,"In honor of the Jalen's. I present to you ""13 Johnson's""",346
1rpmzel,images_jpg/1rpmzel.jpg,https://external-preview.redd.it/cXBvNHg3NHU3NW9nMdVxvrQB9YdMwnidBqOqfcBw33rCDJ8_vDXePULNDbrH.png?format=pjpg&auto=webp&s=177b8f527af4abd29203e5bc554efc60260f52e4,"Deep dive on the ""Jalen's"" in the NBA",347
1rp3t3c,images_jpg/1rp3t3c.jpg,https://preview.redd.it/f0eu6m6dj1og1.png?auto=webp&s=d7672b6b66bb2d00630138829cee1f685ccae8fc,You can't touch Shai,348
1rpzzbz,images_jpg/1rpzzbz.jpg,https://preview.redd.it/l69btqe9k8og1.png?auto=webp&s=0c50e01562a6450fbf1922784c856f0b06a52f83,I don't think that is Cameron Payne,349
1rpy6r1,images_jpg/1rpy6r1.jpg,https://preview.redd.it/i7urtiy988og1.jpeg?auto=webp&s=e5995d7e56ad31e1ad05ee6120de0e5e4d654f01,Throwback to Miles Bridges dominating on national women’s day,350
1rpgkkk,images_jpg/1rpgkkk.jpg,https://preview.redd.it/ppex2vjut3og1.jpeg?auto=webp&s=86207e8cfb35359370cbf44a3057981779617f16,"We only allow ass beatings here, not ass smacking!",351
1rpppbg,images_jpg/1rpppbg.jpg,https://preview.redd.it/8pchpbk1z5og1.jpeg?auto=webp&s=cc11666be5f8ffd77d2efdbf8b5b930ba3f0a375,Just Dort activities.,352
1rpdzg7,images_jpg/1rpdzg7.jpg,https://preview.redd.it/gcp8s7s1c3og1.jpeg?auto=webp&s=f910f272da52d815a2c7409d9f67aa744568ae66,Luke Kornet undefeated against strip clubs,353
1rotx3v,images_jpg/1rotx3v.jpg,https://external-preview.redd.it/OTgzdXZzbWQ0em5nMWoOLlCKvaTx24kJBvte1IB9d6bfX2rUUcggCweeZeMK.png?format=pjpg&auto=webp&s=18da03e5c139b9713b81d613c3d845ec868c6bc5,LeFlirting,354
1rqlbch,images_jpg/1rqlbch.jpg,https://preview.redd.it/9i3f08vwrcog1.jpeg?auto=webp&s=5596a9767bc48403dced5d60f1e5af4ff9019f04,"Best Conspiracy: Jaylen Brown Ejection
1) NBA didn't want Brown to distract from the Heat/Wizards Game

2) Nike wanted Jaylen out so he didn't upstage their athlete Wemby

3) NBA wanted a tight game. Advanced stats know JB is a net negative, ejection guaranteed a close game

4) Basketball gods cursed Brown with bad whistle over misspelling ""Naismith""

5) Drama: JB can't handle Tatum potentially taking the team back, emotions took over",355
1rqgbau,images_jpg/1rqgbau.jpg,https://preview.redd.it/wg2c9ygykbog1.jpeg?auto=webp&s=f2dfe51c0ef1c8c0da23dd05f824c2a706648595,This legit or not?,356
1rp1ej9,images_jpg/1rp1ej9.jpg,https://preview.redd.it/yhtv0itw21og1.png?auto=webp&s=d1d0c30a0f1b3890eca56fe89da977d2ee6a2656,Jayson Tatum's surgeon,357
1ro8y9j,images_jpg/1ro8y9j.jpg,https://preview.redd.it/r0y9r2wmjung1.png?auto=webp&s=59de5731a34679eca9da3570dc12261f7e28121b,"Money doesn't change who you are, it reveals you",358
1ror2u4,images_jpg/1ror2u4.jpg,https://preview.redd.it/mfllnhfuayng1.png?auto=webp&s=d77cad1124f4950017ff8b9fff1ef60fb003e396,Dunking at 10 years old was unfair,359
1rorbpj,images_jpg/1rorbpj.jpg,https://preview.redd.it/ck529irecyng1.jpeg?auto=webp&s=d16ee1b9ca33004546089cce11a85292f8c836d1,The Pistons if Cade Cunningham doesn't exist,360
1rodrnm,images_jpg/1rodrnm.jpg,https://preview.redd.it/qusiyyvigvng1.jpeg?auto=webp&s=5ceb132c0b7a5eb1c5978db5685285148b347462,Bargaining,361
1rokfyf,images_jpg/1rokfyf.jpg,https://preview.redd.it/4fj581nsrwng1.png?auto=webp&s=a39e7e57cdb57aab5415acbf0d63e1f4792ab933,The 2025-26 Pistons,362
1rnvoka,images_jpg/1rnvoka.jpg,https://preview.redd.it/g59aw8md5rng1.jpeg?auto=webp&s=62335c34702a6fbfb6cb5239819a9622099192f6,What is the worst?,363
1rnsqp8,images_jpg/1rnsqp8.jpg,https://preview.redd.it/kho1cv4lfqng1.png?auto=webp&s=5807a564af511a8f1f97c0180b1f076cda575984,Jamal Murray when he sees the Lakers on the schedule,364
1rnfzsx,images_jpg/1rnfzsx.jpg,https://preview.redd.it/k4mdn21ssnng1.jpeg?auto=webp&s=5a3fb8f80f35d7ae2d3b0cc582f3b2f98a52c701,Kobe would be proud,365
1rndyhi,images_jpg/1rndyhi.jpg,https://preview.redd.it/dvuv25cccnng1.png?auto=webp&s=3d5d7a1f48df47201c66d65f85fca1948f764b9b,"""And the Oscar goes to...""",366
1rnx4k0,images_jpg/1rnx4k0.jpg,https://external-preview.redd.it/NmliMXZyZjZqcm5nMSpJkn4ngC42KMRH55YYQGYtEaZlAVceHvxJr7Ju_oK7.png?format=pjpg&auto=webp&s=1df34c66286629ad393cfe62e90367cd746c53e7,Filipino-Serbian Slam Dunk,367
1rnrlw1,images_jpg/1rnrlw1.jpg,https://preview.redd.it/2gxlrf6y5qng1.png?auto=webp&s=3891a0033640d9732fceb7f5f5f24569580357c8,Philadelphia and Atlanta tonight,368
1rnsj25,images_jpg/1rnsj25.jpg,https://preview.redd.it/orz9xv4tdqng1.jpeg?auto=webp&s=f316ae3db885258f3c85cc122f32cb4cccae0f9c,Six Straight Hawks Wins. We own the 76ers!!!!!! Ah Ah Ah Ah Ah Ah,369
1rn4xxh,images_jpg/1rn4xxh.jpg,https://i.redd.it/0jr1ord25lng1.jpeg,[ Removed by moderator ],370
1rmnrp9,images_jpg/1rmnrp9.jpg,https://preview.redd.it/ylsu0o409hng1.jpeg?auto=webp&s=59247e361eb4019329caa8ce0d601fb633f2c904,Thunder fans when you show them a rulebook,371
1rn7hjg,images_jpg/1rn7hjg.jpg,https://preview.redd.it/bmjmqucawlng1.png?auto=webp&s=f5eead0d4dc2e20835d495b67375c21b9a3c50f8,"Wembanyama after every win, Man is a Psychopath",372
