sample_id,image_path,source_image_url,text,raw_order
1sdb912,images_jpg/1sdb912.jpg,https://preview.redd.it/mk3l3f3g1ftg1.jpeg?auto=webp&s=851bf2e72648b7341507faf81eb7a923a3ac30ec,Figuring out how to survive the first round in the playoffs,0
1sd3si1,images_jpg/1sd3si1.jpg,https://preview.redd.it/f6vrvoy3kdtg1.jpeg?auto=webp&s=1d2e2c90f8d2057f761687895a15f2fb1e938a90,What are these thumbnails,1
1scpmg0,images_jpg/1scpmg0.jpg,https://preview.redd.it/qr7jyjr2q9tg1.jpeg?auto=webp&s=4c1131c9100c4f3e1f332e0ee9ce36a691fe75b1,Lakers fans are a different breed,2
1sd66au,images_jpg/1sd66au.jpg,https://preview.redd.it/x2q1qplz1etg1.jpeg?auto=webp&s=a2960c5a5d927ed0ff3e205a2b6bf77a31b4552d,Lakers dark age 💀,3
1scm7w3,images_jpg/1scm7w3.jpg,https://preview.redd.it/f6r5nh9ny8tg1.jpeg?auto=webp&s=b347483f1ff5f42a21f7af4ec26b2198887a83a6,Can we all agree it’s over? Jokic is the MVP!,4
1scrzzh,images_jpg/1scrzzh.jpg,https://preview.redd.it/fsmxkv4gaatg1.png?auto=webp&s=d9af14ff38bd2587ffc205650ac8f0c81e906430,LeBron and Bronny became the first father-son duo to cut the lead to 42,5
1scu49s,images_jpg/1scu49s.jpg,https://preview.redd.it/bltwjwsstatg1.png?auto=webp&s=0e9a52bd6e766059c39e83f8627f61e478345d95,With Luka &amp; AR out for round 1:,6
1sd4l0h,images_jpg/1sd4l0h.jpg,https://preview.redd.it/f8q362h7qdtg1.jpeg?auto=webp&s=550018029e28fa572afd143f1d7c68326a88ac92,Will the real SGA please stand up?,7
1scmj57,images_jpg/1scmj57.jpg,https://preview.redd.it/ccxqf5s219tg1.jpeg?auto=webp&s=3d4287d51f8cb772aa39bd1eece787fee8fb2bb6,"Lakers’ fans relax, we good",8
1sdcoud,images_jpg/1sdcoud.jpg,https://external-preview.redd.it/bXdqbDF6cGdiZnRnMfxOKOxpPHY7d4RLpbrqtUQo__5xRt9Of-AHUZgg3q58.png?format=pjpg&auto=webp&s=6e4b5f07df7cea2c7ea5214b7bfa4740170ba59f,Luka Dončić and Austin Reaves are in the hospital,9
1sch52t,images_jpg/1sch52t.jpg,https://preview.redd.it/xr5ctla4y7tg1.png?auto=webp&s=e531b197ef57bac16331796c913ec0f8c68ebc2d,"Rudy Gobert is the best defender of all time! He's so good in fact, that he was able to lock down the entire NBA!",10
1sdcr8f,images_jpg/1sdcr8f.jpg,https://external-preview.redd.it/d2FyOTA3cHdiZnRnMT4i0w-qhcuJOGpm2bD-vP4U6uztZuTNzLy23-T_LB_r.png?format=pjpg&auto=webp&s=8648c2bbf1e0f83d2cf531b6ea7f07fd4c63fcda,Do you know there’s something called LeBron loneliness? LeBron is going to carry the playoffs all by himself this year 😥 LeLoneliness 😩,11
1scqwhm,images_jpg/1scqwhm.jpg,https://preview.redd.it/rbuauefx0atg1.png?auto=webp&s=c90d01d0c13099a02a392c3e8d4dd611c504dd10,They did him dirt,12
1scnehm,images_jpg/1scnehm.jpg,https://external-preview.redd.it/cWtvbGRxenY3OXRnMQvXFeET46URgi5i4z6JFn5ZFGIfBLFAInrrl9qpurIZ.png?format=pjpg&auto=webp&s=45de8bf0fc52bff1ec0400bc13488633756401c1,Wemby vs Jokic today,13
1sccjm2,images_jpg/1sccjm2.jpg,https://preview.redd.it/uxplt0bu17tg1.png?auto=webp&s=88d5d9185a1e45a97479ea444b8485b514318bc2,SGA's signature push-off will win him this noble award,14
1sclkq8,images_jpg/1sclkq8.jpg,https://preview.redd.it/0wbyhinst8tg1.jpeg?auto=webp&s=96c1f1435e4e29f1df5c8c4d852e47cc982fa132,Just trying to laugh thru the pain,15
1sco52w,images_jpg/1sco52w.jpg,https://preview.redd.it/nuxtj6apd9tg1.jpeg?auto=webp&s=0111f21b3e2034fd37ee277cabf2f8fcf29033e4,"I don’t think many people understand that Langston Galloway is mostly responsible for qualifying Team USA to them World Cups in the first place
LeBron who? This here is the real Captain America!

Man is always available to rep the flag in FIBA competition whenever the NBA guys are still in the middle of the season. 🫡",16
1sbv590,images_jpg/1sbv590.jpg,https://preview.redd.it/nb45gwfsm2tg1.jpeg?auto=webp&s=6e95a64b72684148d986aba71b8b8b495537ced8,AR about to go on a historic scoring run,17
1sb8j05,images_jpg/1sb8j05.jpg,https://preview.redd.it/ek2e9vdtyxsg1.png?auto=webp&s=20e3ce8e180b9cffee1ad193a2278e7f4e556014,"""Pack your bags Bronny, we're going back to Cleveland""",18
1sb29i3,images_jpg/1sb29i3.jpg,https://preview.redd.it/ajirst9x7wsg1.jpeg?auto=webp&s=82f6423385121ae79aff6d59b42c8b9180b1a83a,Thunder and Spurs really on a tier of their own 💀,19
1sbwxq1,images_jpg/1sbwxq1.jpg,https://preview.redd.it/mn7ufhio13tg1.jpeg?auto=webp&s=b895d7e0f4ae8d6e319d4cf52641558849d80444,Lebron not in the Epstein files in any substantial way,20
1sb2lhu,images_jpg/1sb2lhu.jpg,https://preview.redd.it/ar93rtovawsg1.jpeg?auto=webp&s=23664f496623991a075d5b4a2d929bb3e8b9ae47,LORDDD HAVE MERCY! 😭,21
1sb2krx,images_jpg/1sb2krx.jpg,https://external-preview.redd.it/YjJjdjQ1eG9hd3NnMWwKjflUpoNBqgC5dyQKddlQI7Q3Ki8WbIzL_8RM5TYx.png?format=pjpg&auto=webp&s=7c7526c209604288b3927c9460d139dbbd1630fd,Bronny hits a huge three to cut the lead to 42,22
1sbzft5,images_jpg/1sbzft5.jpg,https://preview.redd.it/lkgpewpln3tg1.gif?format=png8&s=26e59e38cbe5780110660347ce128dcf0c6f6b55,Hawks Stomping Thru Brooklyn Like What!!!! Four Straight!!!!,23
1sb1zyc,images_jpg/1sb1zyc.jpg,https://preview.redd.it/5nindzok5wsg1.png?auto=webp&s=7689ef2e4c076e00c27493e577baa9c80b9466cd,Are you sure? Yes. Yes I am.,24
1sbhwd4,images_jpg/1sbhwd4.jpg,https://preview.redd.it/ke2tvs9920tg1.jpeg?auto=webp&s=05e354105f380135ca3e20404cb79a5febec923c,What the heck is Schröder doing?,25
1sb3bwx,images_jpg/1sb3bwx.jpg,https://external-preview.redd.it/czFnOXN6YmZod3NnMaVBKa5gHGEXoXIJ_6fdV1qGb02_xwZDn3NFdjadAmBD.png?format=pjpg&auto=webp&s=7486430a7aafa9f65ba48b37ce55bbe02d3a03fa,Luka missing out on All-NBA for a 2nd straight year.,26
1sb15qe,images_jpg/1sb15qe.jpg,https://preview.redd.it/zj8kdwujyvsg1.jpeg?auto=webp&s=4bb9a1001e3b79fab8575874a98da5c923c30154,The Lakers are contenders,27
1sb2yfc,images_jpg/1sb2yfc.jpg,https://preview.redd.it/whcz2mp3ewsg1.jpeg?auto=webp&s=f9567907c7bdd5d669b77854e6a028300d806a6d,SGA tonight: 28 fts 7 fts 7 fts with a +35 fts and 1 to,28
1sb1vac,images_jpg/1sb1vac.jpg,https://preview.redd.it/gaahhm2h4wsg1.png?auto=webp&s=f5e858eba5477709174d3d1d83a0069834b6e55f,Petition to replace the Lakers logo,29
1sacexg,images_jpg/1sacexg.jpg,https://preview.redd.it/zb2j000rdqsg1.jpeg?auto=webp&s=6adcfc54cce7f906054a24dfd38fcbc29ec2ec78,"Forget the 100 point record, which player is mostly likely to get a quadruple double again? 👀",30
1sagknh,images_jpg/1sagknh.jpg,https://preview.redd.it/c1irzq9zxrsg1.jpeg?auto=webp&s=60aa51e9d967563f71079df3f145eb062e3d7ae4,More free throws for SGA!,31
1sb1pgj,images_jpg/1sb1pgj.jpg,https://preview.redd.it/f5s7y6c13wsg1.png?auto=webp&s=7c0e2d5df845489d40c74d4fef3577e47d9d2d84,National Blowout Assocation,32
1sagkec,images_jpg/1sagkec.jpg,https://preview.redd.it/pnobv6xrxrsg1.jpeg?auto=webp&s=5c33123138cca2642bfe6573949349494578e840,Jason Kidd responded to comments from Mark Cuban indicating that Kidd was involved in the process of trading Luka. Bro just wants to leave the past behind 😅,33
1sale76,images_jpg/1sale76.jpg,https://preview.redd.it/53jhsde3vssg1.png?auto=webp&s=109ab33ba6246f2500902e56c16fb19663e9616e,"""April Fools""",34
1sacr69,images_jpg/1sacr69.jpg,https://preview.redd.it/yi1fpai4zqsg1.png?auto=webp&s=67cd905ff50186f49da52845f5bdb95a93ab4db4,The Milwaukee Antetokounmpos,35
1s9oyog,images_jpg/1s9oyog.jpg,https://preview.redd.it/4qcbnfi2slsg1.png?auto=webp&s=3ec8e71130a8d15afb1b846345c5a494b48a26f1,Bruh AD,36
1s9r3jb,images_jpg/1s9r3jb.jpg,https://preview.redd.it/bvt8qpnc5msg1.jpeg?auto=webp&s=00590b8222e8b6d368de8e5e23aa89bdde2d91b6,Jaden Ivey right now,37
1sallit,images_jpg/1sallit.jpg,https://external-preview.redd.it/NHM5bHRkOWZ3c3NnMft10XiT4kBmPjgjNg7ZfTOeSjmrnkVqbEY-BEWvyn8n.png?format=pjpg&auto=webp&s=a45962b852b39163708e3c93a7fab484fbeff2a9,Victor Wembanyama be moving like Mr.Fantastic 😆😆,38
1sbikip,images_jpg/1sbikip.jpg,https://preview.redd.it/f6xa9gps60tg1.jpeg?auto=webp&s=6e331679f83aca427897880ff486ac80f111d002,"Luka at OKC losing MVP race
https://youtu.be/Y9j3heYZAk8?si=ktHKX4K6j8X2EMls

Luka going down vs okc. Sorry MVP season. Shai it’s yours to lose to Wemby now",39
1sa7j44,images_jpg/1sa7j44.jpg,https://preview.redd.it/h9isqi4qfpsg1.jpeg?auto=webp&s=f4f709ac6dd128eee14583a3ad4168de3f519373,As a Warriors stan...this feels like a funeral march,40
1sa57ev,images_jpg/1sa57ev.jpg,https://preview.redd.it/dmgoo8zdvosg1.png?auto=webp&s=c40dd5f5d3af92a1f0fdeacfa5070f022caa36a8,"SGA is the 4th referee, you can't touch him",41
1sa79nq,images_jpg/1sa79nq.jpg,https://preview.redd.it/rpzfaiczcpsg1.png?auto=webp&s=85e14568875e47399e9d385a73e0d59c5a279e15,"J. Cole has signed a contract to play in the Chinese Basketball Association with the Nanjing Monkey Kings, per ESPN sources. The multi-time Grammy award-winning and multi-platinum artist had committed to playing a few games for the Chinese team last year, and now follows through.",42
1saaayw,images_jpg/1saaayw.jpg,https://preview.redd.it/exg2licz7qsg1.jpeg?auto=webp&s=8318edc8f56077ab84b277b16d3e1a64aa26129c,delayed revenge but spurs fans never forget,43
1sa66dd,images_jpg/1sa66dd.jpg,https://external-preview.redd.it/dTY5M3RzNXAzcHNnMfWNxMgYwpHxuinx048xhDqtpcDeeO3pxE5NoZA_vX9j.png?format=pjpg&auto=webp&s=98589a83b0e5818f0b6127335a2007cb9d5dc17b,What it’s like hate watching,44
1s9s49m,images_jpg/1s9s49m.jpg,https://preview.redd.it/27ofsy0obmsg1.jpeg?auto=webp&s=8c1e5fd3a95ad86edd9dd30176b55a905fad2a56,Cool! Looks like I’m Wemby then 😎,45
1sa25bl,images_jpg/1sa25bl.jpg,https://preview.redd.it/0xqwanh87osg1.jpeg?auto=webp&s=d9c286255582ff43a2966a16ced12f2398cce3ae,It’s rough out there for us bulls fans rn,46
1saga01,images_jpg/1saga01.jpg,https://preview.redd.it/ietdfrjlvrsg1.png?auto=webp&s=81c41abdef2f96b8798b9c85413f5b44a09ce920,Wembanyama's character sheet. Height: ERROR. Exceeds character creator limit.,47
1sb8nra,images_jpg/1sb8nra.jpg,https://preview.redd.it/yloc33zk0ysg1.jpeg?auto=webp&s=57e311c5fc27f84a8ab17b393c02445695882f47,The NBA if it was only cities where players want to live,48
1s9dhu5,images_jpg/1s9dhu5.jpg,https://preview.redd.it/chgj47nm5jsg1.jpeg?auto=webp&s=f3853e8347a0659895115b477d57b5666e045cca,Anyone still thinks Jaylen Brown is better than Luka Doncic?,49
1sa7jd3,images_jpg/1sa7jd3.jpg,https://preview.redd.it/dvpy55qsfpsg1.jpeg?auto=webp&s=7b9406c37ed8440b8e49c2c2a4b803ef5dc1c7b7,Hawks Sweep The Magic.,50
1s9860d,images_jpg/1s9860d.jpg,https://preview.redd.it/ge785agkrhsg1.png?auto=webp&s=7dbfebfa7f5ca93630b1283c463141764675c224,"But when you slightly touch Shai, it's a foul",51
1sa4dec,images_jpg/1sa4dec.jpg,https://preview.redd.it/n6v99k61posg1.gif?format=png8&s=522917ec77f0574ca3287677ab3a1b0516619e28,The Magic Doesn’t Work on The Hawks!!! That’s three straight wins!!! Ah Ah Ah!!!,52
1s9ncf4,images_jpg/1s9ncf4.jpg,https://preview.redd.it/em7znclthlsg1.jpeg?auto=webp&s=7532d8a4de43f0f7621f42f3fcd993ce9a32b998,"How I, as an LOTR fan view Victor.",53
1s8mq96,images_jpg/1s8mq96.jpg,https://preview.redd.it/9doqnyd0pdsg1.png?auto=webp&s=4fe7239c644840c068ac7531c4289d50072e151a,Shai was so shook that the ref called the push-off,54
1sa4bro,images_jpg/1sa4bro.jpg,https://external-preview.redd.it/zQyRP4KS762ZG-ccf-XarqqWaD28XoB31M4ypXIwMO8.jpeg?auto=webp&s=30881c2c6b6f03ca0ba8179729337e0c094cb888,He asked Ant if he ever took a number 2 during a game two years ago.,55
1s9b0ib,images_jpg/1s9b0ib.jpg,https://preview.redd.it/hnnur7tbgisg1.jpeg?auto=webp&s=5b911eebfc76cf564d1e13b0f7324dde5aed62fe,Go Blazers,56
1s95pk1,images_jpg/1s95pk1.jpg,https://preview.redd.it/ukmg21vc8hsg1.jpeg?auto=webp&s=89ed1f9fdb3dffbca7ab121656ffeb28ecdf3673,stupid award,57
1s8tw04,images_jpg/1s8tw04.jpg,https://preview.redd.it/gvcyeb3f0fsg1.jpeg?auto=webp&s=f3a1f76fcb560d430d5fbe694f7dca6a62137b38,"Its not funny anymore...
Ivey said said some really reprehensible thi gs but he also seems to be going through something mentally. He also has made references to childhood abuse trauma",58
1s8eqcg,images_jpg/1s8eqcg.jpg,https://preview.redd.it/u9v0gpuuhbsg1.jpeg?auto=webp&s=b14d5cb79f3e1e53a82e50f539d8d1dd9587ba25,SGA with 25 FTAs tonight,59
1s9p7pt,images_jpg/1s9p7pt.jpg,https://preview.redd.it/3nwtap6ltlsg1.png?auto=webp&s=8b49ea8e638a5013b9d0a89d51f2b49050aca58b,"Conquest dunking
""I am so lonely. All the other players are scared of me.""

Btw it was hell editing Oliver out of this because I suck at editing things out.",60
1s8ovvz,images_jpg/1s8ovvz.jpg,https://preview.redd.it/5qt894of3esg1.png?auto=webp&s=41e83050cac7ec401e088e1f56040f5963747997,"""shit man just do what you do."" - LaMelo the vet",61
1s96gin,images_jpg/1s96gin.jpg,https://preview.redd.it/8t8es598ehsg1.jpeg?auto=webp&s=318b8c9a04edc55aa86ac9c575902f231d8ff069,Who came up with the this mascot and its name?,62
1s8hn84,images_jpg/1s8hn84.jpg,https://preview.redd.it/eyghspgadcsg1.jpeg?auto=webp&s=1ec96d710175e76a264cf8b71be1e62dd148a7dc,TIL: DeMarcus Cousins still plays pro basketball… in Mongolia 🇲🇳,63
1s8ejxu,images_jpg/1s8ejxu.jpg,https://external-preview.redd.it/aTM4ZTg4czNnYnNnMQYRFnxZnXyCzYmPoHuY5-zpGLrNGvdmFKFQueb2zX3W.png?format=pjpg&auto=webp&s=53fd1ef7cdc4f44e85735a52175c81b146eb938f,Ant didn't start in the game tonight because he was taking a shit lmao,64
1s7yixk,images_jpg/1s7yixk.jpg,https://external-preview.redd.it/OWk1cXNwa2E0OHNnMUpQiagxHydJ49KzTW_h4rA_0mFmZtmxX-tETyypmZHa.png?format=pjpg&auto=webp&s=a11900992db3230a37942aee528c12391606617f,An NBA Coach could NEVER get away with this! 😏😅,65
1s8dcz0,images_jpg/1s8dcz0.jpg,https://preview.redd.it/1f6lco1u4bsg1.jpeg?auto=webp&s=196323217c30cb62a8b080f45703788eb24b4541,How tf the game went to OT,66
1s7uutj,images_jpg/1s7uutj.jpg,https://preview.redd.it/b4z1q2xlh7sg1.png?auto=webp&s=c494fb419e77dd2983d0f1941a21d200d95b2fcb,"""The most hyped prospect since LeBron""",67
1s8dedm,images_jpg/1s8dedm.jpg,https://preview.redd.it/y0isc5h05bsg1.png?auto=webp&s=9b12821cf04270d40db2499bdb83fb2db5ace09f,"GP2 did Zeke Nnaji dirty, bro’s forehead was not ready",68
1s7uo0a,images_jpg/1s7uo0a.jpg,https://external-preview.redd.it/ODUwZHAwbmlnN3NnMUz4VQp6mUvBVEOFdTlrsPd8ajLlf4evWkhUVJvIoSyM.png?format=pjpg&auto=webp&s=7bc403abbff3bde9266dbea53a3e7e7d475b0e0c,Prime glassman Day-to-Davis,69
1s8ankg,images_jpg/1s8ankg.jpg,https://preview.redd.it/hmwlo36whasg1.jpeg?auto=webp&s=c434d8efde843732febd508452d7afcae56f6872,Jaden Ivey waking up this morning:,70
1s8o6q8,images_jpg/1s8o6q8.jpg,https://preview.redd.it/doogmk0pzdsg1.png?auto=webp&s=4c9eaf86dc6f4646100ababfd77063f223155b87,Anthony Edwards character sheet. 421-game starting streak ended by a toilet!,71
1s8i1rp,images_jpg/1s8i1rp.jpg,https://preview.redd.it/889k13jihcsg1.jpeg?auto=webp&s=1de189f29343afa4128eaaba5b5b0f2b66f338c9,Career defining move,72
1s8pe51,images_jpg/1s8pe51.jpg,https://preview.redd.it/9bqf11ep7esg1.jpeg?auto=webp&s=064eddf97b1fc4ddab777a0ef3507b5cf2275e73,Hawks Crept Up On The Leprechauns And BLADOW💥 2 Str8 Wins!!,73
1s8l8ym,images_jpg/1s8l8ym.jpg,https://preview.redd.it/uu9ml8mbcdsg1.jpeg?auto=webp&s=4a3cd3cbd1a87da190ff83e8c73851d8c22225cf,"I'm Embarrased - Hawks Logo
I've been a fan since I was a kid who moved to Atlanta in 1992. Thirty-plus years!

I was on [NBA.com](http://NBA.com) just now looking at standings, and I noticed something that I never have before...I finally saw the Hawks logo the way it was meant to be seen.

My whole life I've been viewing it right to left. It always looked like some predatory Pac-Man-esque creature, like a hawk with a single tooth and open beak snapping at prey or something.

But today, for the first time ever, I viewed it left to right. And it's clearly just... a hawk. In flight probably. That's it. That's the whole thing.

I feel like an idiot. Thirty years. I can't be the only one. Right? Right??",74
1s84s6l,images_jpg/1s84s6l.jpg,https://preview.redd.it/rdh4jdps89sg1.jpeg?auto=webp&s=dfa6ce7e46e0dce79028d0599bf1433080924db4,Which team do you support? (Me? Every Team),75
1s7ffda,images_jpg/1s7ffda.jpg,https://preview.redd.it/fs3k5mhto3sg1.png?auto=webp&s=29e482b572c592c069ba068f2b2808e6c4c0e392,Mark Cuban reposted this image of Nico Harrison getting trolled,76
1s7u9sj,images_jpg/1s7u9sj.jpg,https://preview.redd.it/8ev8sjd1e7sg1.jpeg?auto=webp&s=bb8e7c21382a6c699a7297b64009650c59063799,This is too funny 🤣🤣🤣🤣🤣🤣,77
1s7nbi8,images_jpg/1s7nbi8.jpg,https://preview.redd.it/26xapspzy5sg1.png?auto=webp&s=9ba4e21b1e00201383adc20ff9cc2f43bc272b6a,Are The Magic Okay?,78
1s887kc,images_jpg/1s887kc.jpg,https://preview.redd.it/asui3m5by9sg1.jpeg?auto=webp&s=ca6b9f16008367a340346ab405fa5b90668d46df,DEEEEETROIT BASKETBALLLL,79
1s8wgdn,images_jpg/1s8wgdn.jpg,https://external-preview.redd.it/_cc2POROHfT0qBHYDlavMXia_vL4KZnK3aixY9Mz20o.jpeg?auto=webp&s=fedd4d1c870df916288d644cbcd44b9cbe489e06,"NBA Royals
After watching NBA highlights last night, I changed the lyrics to Royals to be about players traveling.

I've never seen a travel called in years, 

At least not on a superstar, in clutch time.

I'm not proud of that skillset, 

Couldn't get away with that, at L.A. Fitness.


But every game's like

Crossover, 'steps' back, trippin up defenders,

Pump fake, step through, switching the pivot foot,

Refs don't care, they're hittin parlays on Draft Kings,

But all the fans are like,

""Gather step, zero step, definitely a clean play.

That's just the game in the modern NBA.""

Refs don't care,

Ten times a play, always carrying,

And they're NBA Royals,

Giving the refs a hug,

Those kind of whistles ain't for us,

Unless a foul happened to us.

Let me be your Crew Chief,

You can call me Tony B.,

And baby no rules, no rules, no rules, no rules,

Let me be your MVP",80
1s7f1rs,images_jpg/1s7f1rs.jpg,https://preview.redd.it/oxenxiuil3sg1.jpeg?auto=webp&s=faa490f0b68da3fa34ee4e343e5f3ebccc3f5f3a,Did my boy Bronny dirty,81
1s78a5t,images_jpg/1s78a5t.jpg,https://preview.redd.it/8uxw6gy732sg1.jpeg?auto=webp&s=5313a70817c5c8b44c0e8d0fb264fc546f1d6512,What else must Luka do to win MVP?,82
1s73m7v,images_jpg/1s73m7v.jpg,https://preview.redd.it/0u135f7y41sg1.jpeg?auto=webp&s=9f0697b26f019c3c26fafea001beb43847fc038e,"Oh, the markets they'll overlook!
I really began to think about this as Houston took the WNBA back from Connecticut, and thinking about how KC and Rain City never got their flowers after Sacramento and Memphis took them away and let them wilt.",83
1s7arvz,images_jpg/1s7arvz.jpg,https://preview.redd.it/r42dk8w3m2sg1.jpeg?auto=webp&s=fe44599dbfe47c409fedb1201019ad11d7c7cdc1,Push off?,84
1s7d1rw,images_jpg/1s7d1rw.jpg,https://preview.redd.it/ifhpm6hf43sg1.jpeg?auto=webp&s=b2b15ade62ffc252b24accf9d10cf5e6802f46fd,You can be the next PAT BEV (2025)!!!,85
1s7c3vd,images_jpg/1s7c3vd.jpg,https://external-preview.redd.it/NG00MHRheWx3MnNnMUVonUm7s8nq-oGvlzURKtLT-hr1c8kyJEkWGvnoByNW.png?format=pjpg&auto=webp&s=0a5cda953a4f1ffb2cc56088db6cdc5258d94b00,Jokic Daydreaming,86
1s6pxc2,images_jpg/1s6pxc2.jpg,https://preview.redd.it/rgjx3zo66yrg1.jpeg?auto=webp&s=673cd6c27ad8c35b051097899c65ebca0da6784a,Devin Vassell (Left) pictured with Stephon Castle (Right) and Victor Wembanyama (Middle),87
1s6oe9u,images_jpg/1s6oe9u.jpg,https://preview.redd.it/ves7tpzsixrg1.jpeg?auto=webp&s=c7efe8c5ed6d020b54b60884d7b3014d578aa251,Which duo would win the most rings?,88
1s7jequ,images_jpg/1s7jequ.jpg,https://preview.redd.it/a4m82mtas4sg1.png?auto=webp&s=ce3871198900a32d1837a86b335b2f6c0570ac41,"Jimmy Butler character sheet. 4 teams, 3 suspensions, 1 ACL. The build is chaos!",89
1s7dx9l,images_jpg/1s7dx9l.jpg,https://external-preview.redd.it/ZHhoYThwem9iM3NnMRBR2XCoi3D-lLhnqNukqcKp7nAS_CQRWQY12SnzwnZQ.png?format=pjpg&auto=webp&s=3b383194b6ebdac5042e16f2c80e1566e9aeda92,Really getting after it 😂,90
1s7as98,images_jpg/1s7as98.jpg,https://preview.redd.it/loa1gog6m2sg1.jpeg?auto=webp&s=06beede388eb554b0f81bc277e95ed74dec8cab9,Name a better jersey swap,91
1s6vp43,images_jpg/1s6vp43.jpg,https://preview.redd.it/irtj8fdmozrg1.png?auto=webp&s=4aa63ca36f0a27fd8198c342c155bd99a4b241ad,Freeze frame of Sengun shaking the blood off his lip from the Rockets vs Timberwolves game lol,92
1s6ym3t,images_jpg/1s6ym3t.jpg,https://preview.redd.it/tw7n1y3g90sg1.png?auto=webp&s=fbf4d7b341ab6ec1352e982e763f454f9b31ae74,Might have to sub Steve Kerr in,93
1s708az,images_jpg/1s708az.jpg,https://preview.redd.it/mctihdgek0sg1.jpeg?auto=webp&s=282c5ea8aaf8406656a1896c5bbb2f86e3c34180,"Pre Champs vs Champs
Phil Jackson coaching the Pre champs​​, Pat Riley​​ coaching the champs. ​Young and athletic vs ​the savvy vets? ​​​​​Which version of these squads win?

Edit: No Nets Kidd, Heat Lebron or Laker Shaq for obvious reasons​​",94
1s6jtvt,images_jpg/1s6jtvt.jpg,https://preview.redd.it/wlp8lufufwrg1.png?auto=webp&s=c5fb6de13c50eedc53b45910f096ae706d8a695c,Jalen Duren hit a tough shot over Zion Williamson then smacked Zion in the butt,95
1s6atvo,images_jpg/1s6atvo.jpg,https://preview.redd.it/fgydxr3sgurg1.png?auto=webp&s=deae4ee20255ff998391320d0b19e2d7396414f8,"Bro WHO is this guy??
no litterally who is he? Ive seen people call him los pollos and other things. He's at many nba games too.",96
1s645yr,images_jpg/1s645yr.jpg,https://preview.redd.it/ycthdr0j6trg1.png?auto=webp&s=6764cefd7902fda9e680ce79fd8c73a134be2e1b,Shai and Tatum pay tribute to Kobe,97
1s7mvir,images_jpg/1s7mvir.jpg,https://preview.redd.it/1agjztiiu5sg1.jpeg?auto=webp&s=bdf6d15c3c43fd3ab928b69e9e679acab06c8a78,Greatest 1 hit wonder?,98
1s6c22k,images_jpg/1s6c22k.jpg,https://preview.redd.it/vcc2jdwjpurg1.jpeg?auto=webp&s=4eef3e0dfed5651e10e943dd73cc8fb899b693f0,"It’s not “goodbye”, it’s see you later @chicagobulls",99
1s64mhb,images_jpg/1s64mhb.jpg,https://preview.redd.it/ycueauqo9trg1.jpeg?auto=webp&s=71853c49c2ed944987d349fd44166bd11af41926,Took the Mid from Akron and son 2 years just to get 1 assist,100
1s6jn0z,images_jpg/1s6jn0z.jpg,https://preview.redd.it/42l6v595ewrg1.jpeg?auto=webp&s=ea7bf85111479d191fe3e8a7022ce2bcbfdca553,One Royal Atl Hawks Win! Bow Down Kings! Ah ah!!,101
1s61xd0,images_jpg/1s61xd0.jpg,https://preview.redd.it/ujuz6uz1rsrg1.png?auto=webp&s=e4c31f1f90f4d60de92322c6951e1dd29f58ffaa,"My favorite thing about the LeBron vs. Skip Bayless feud is that it’s always one-sided. Skip Bayless has tried everything to get his attention, but LeBron has never acknowledged him.",102
1s5zqs6,images_jpg/1s5zqs6.jpg,https://preview.redd.it/gi6244guasrg1.jpeg?auto=webp&s=34cb850dc07af5e41b8194a46528b9d2cbb82a40,Ima tell my kid this guy scored more than Kobe,103
1s65fqd,images_jpg/1s65fqd.jpg,https://external-preview.redd.it/dNjYTuJyEoKCUhWuPu5gYPis4mvJV74N4sW1Qhz2p7k.jpeg?auto=webp&s=eda7a2b36de6ff7320a8b7df80b0f73209c426ac,Which NBA player would thrive here,104
1s5d5bm,images_jpg/1s5d5bm.jpg,https://preview.redd.it/w6kef5fzwmrg1.jpeg?auto=webp&s=3af9dde98e7667a5c7a65418e9fe50de651b696e,👀🤫,105
1s61sb5,images_jpg/1s61sb5.jpg,https://preview.redd.it/flv062b1qsrg1.png?auto=webp&s=73dc81a368cefc0c378e5c90712bc5a665e60310,LeBron's character sheet. Year 22. The process cannot be terminated.,106
1s5sqa3,images_jpg/1s5sqa3.jpg,https://preview.redd.it/r1bvohssaqrg1.png?auto=webp&s=11ce6dfb64b2acdf79cef978e133a9bbb0933083,"You literally can't tough Shai, it's just physics",107
1s580on,images_jpg/1s580on.jpg,https://preview.redd.it/1ie1y3ch0mrg1.png?auto=webp&s=2b27c787559ba7982046af1e29028c383c4d537d,"""I'm fine in the West""",108
1s5cyam,images_jpg/1s5cyam.jpg,https://preview.redd.it/zimtlbbovmrg1.png?auto=webp&s=f7661a015635bb12e7777238054fb5e63148de96,Adam silver when the pacers might have their first top 5 pick in 40 years,109
1s5bg7m,images_jpg/1s5bg7m.jpg,https://preview.redd.it/dks173zzlmrg1.jpeg?auto=webp&s=edc9273b7f0d80da169d08505baf99d497a4c973,Adam Silver determining which teams to punish for tanking after the new rule changes:,110
1s5dskm,images_jpg/1s5dskm.jpg,https://preview.redd.it/epbtsgj81nrg1.jpeg?auto=webp&s=4b690cd22ebe0bbef9fdd6c1cf7a04dfe8cd8cb8,Adam Silver trying to fix things that weren’t broken under David Stern,111
1s4usje,images_jpg/1s4usje.jpg,https://preview.redd.it/na8mbsffrirg1.png?auto=webp&s=f100512055b93d36290f0ad641ed8c3c4ef75e53,"Nikola ""Gru"" Jokic",112
1s4c908,images_jpg/1s4c908.jpg,https://external-preview.redd.it/NzdmN2hmcWgxZnJnMdG3weUebXt0pIgvw22_HbiEC5DJJeeWs4KMNakMe2D6.png?format=pjpg&auto=webp&s=d403cd186ff445fb692e93c3ab003abc52d12df2,Derrick White vicious foul on SGA,113
1s5qnsi,images_jpg/1s5qnsi.jpg,https://external-preview.redd.it/u74RqoF7GJce2Bu2sJTn-z5Ae9uYBVslUMfMy62XV0A.jpeg?auto=webp&s=e646cbcee877b641e7b969d5c9952859eeb12c39,[OC] What KD would look like if his CeraVe ad was true,114
1s58fc9,images_jpg/1s58fc9.jpg,https://preview.redd.it/84w372703mrg1.jpeg?auto=webp&s=bd1a9a5d0768139f979e14a0e3c10d6b19461ac1,Good to know,115
1s4by1a,images_jpg/1s4by1a.jpg,https://preview.redd.it/rsih1yggzerg1.png?auto=webp&s=31f2ccec4a66f07e4f0b5f47eb0e5dbc52938fcc,"The Sacramento Kings got beat so badly, their social media pages didn't want to post the final score bruh",116
1s4beh3,images_jpg/1s4beh3.jpg,https://external-preview.redd.it/bWM5eWJkZ3Z2ZXJnMQzgffFMimWgJQ_io8tP46uNQauit2ErHdeX3UMquZPX.png?format=pjpg&auto=webp&s=5a256b71b11297d6148bc52a7d712ddc6f405f4d,When the game ended Julius was pointing and laughing at Scott Foster lmao,117
1s4p86a,images_jpg/1s4p86a.jpg,https://external-preview.redd.it/dHk2OTMyMjhoaHJnMZsLyhEADpg2d98mgzw16vB332nmvZv9kRTCZ_FJvbg2.png?format=pjpg&auto=webp&s=192dd63d2573466dcc71382597c83ba2a69be547,Bro was baptizing everyone,118
1s4krem,images_jpg/1s4krem.jpg,https://preview.redd.it/lcdo2zvdlgrg1.png?auto=webp&s=6fe7d8aad33777992ece5ff2dddcc7c3a96d3d13,LoL! Isiah Thomas still upset that MJ made sure he couldn’t be on the Dream Team in 1992,119
1s4facd,images_jpg/1s4facd.jpg,https://preview.redd.it/px5rgysukfrg1.jpeg?auto=webp&s=bc87f46b4fcd4035a359af5b16d7db3eec53d5dc,🌯🧔‍♂️,120
