sample_id,image_path,source_image_url,text,raw_order
1qth5xe,images_jpg/1qth5xe.jpg,https://preview.redd.it/h4dax1fchzgg1.jpeg?auto=webp&s=94486008e4f1a051484cc5a10ff0a66a4231ae04,"This is a real thing in Denver. I did not photoshop this.
Makes sense, Jokic and high energy are pretty much synonymous. I’ll be sure to drink several of these the next time I have a job interview.",717
1qtb0fa,images_jpg/1qtb0fa.jpg,https://preview.redd.it/k9cv65ir8ygg1.png?auto=webp&s=8beeaf6fbba6110524c2b6e577874a748ba2741d,"11 Teams, 8 Trades",718
1qtaxzk,images_jpg/1qtaxzk.jpg,https://external-preview.redd.it/eHZ2dDd1N2I4eWdnMUL5mxRhyBMnqPD208BWZz7jCe7DUyjCnEUnpPF2HeZx.png?format=pjpg&auto=webp&s=75aefcb1e2123882a631537d003a2d6ac42ea7ab,One Year Ago Today: Steph &amp; Draymond’s Live Reaction to Luka-to-Lakers Trade News,719
1qte2in,images_jpg/1qte2in.jpg,https://preview.redd.it/swfmubcvtygg1.jpeg?auto=webp&s=528a41d0b099984dda3200a72ec9d2c1d7bf80fe,Living his best life!,720
1qtf50l,images_jpg/1qtf50l.jpg,https://preview.redd.it/c5x3w3kk1zgg1.png?auto=webp&s=6f10d75de3e334bc468ec277206c0b8ea7efe6e0,Wemby in a few years.,721
1quap5r,images_jpg/1quap5r.jpg,https://external-preview.redd.it/r6RCfpcJrsOEvxmt4-r5srsPa-Al0Z543HmbhpRV_5E.jpeg?auto=webp&s=cd1496b7bb88c47713cad82a4c66db4f0c9487f2,"All of LeBron James’ Turnovers So Far
lEbRoN aLwAyS mAkEs ThE rIgHt PlAy. He Is OnE oF tHe BeSt PlAyErS iN tHe LeAgUe. He NeEdS mOrE hElP.",722
1qs3umb,images_jpg/1qs3umb.jpg,https://external-preview.redd.it/Z3lwNnF2eHgzcGdnMf-AnLjIIuPb_TvVpjcx5FckECZLVSdLk0i8Px-D53O-.png?format=pjpg&auto=webp&s=752cee52433741c05a5edcb59df9cbb51ba53598,"A recently retired Michael Jordan stops by the Bulls practice and Corey Benjamin says to him ""I'm sorry you retired, cause I wanted to take you 1 on 1"". Jordan (of course) took that personally and immediately challenged Benjamin to 1v1 (1999)",723
1qrllij,images_jpg/1qrllij.jpg,https://preview.redd.it/qd8ap4iplkgg1.jpeg?auto=webp&s=221d74c5651d8de00aa5454629a26c583d1f6374,Everyone complaining about the court being slightly raised in Cleveland. Meanwhile at the University of Minnesota:,724
1qr8nj2,images_jpg/1qr8nj2.jpg,https://preview.redd.it/ea9esmev9igg1.jpeg?auto=webp&s=b18aa9dca9be3f7e8c61b0b38a54765cc8a05495,"Steph Curry is not the GOAT shooter anymore.
The streets tell me that Bronny is the worst player in NBA history and blah blah blah.

Well in the BIG 2026 he’s surpassing your idols.",725
1qrmqwq,images_jpg/1qrmqwq.jpg,https://preview.redd.it/pt9941v0ukgg1.jpeg?auto=webp&s=72d627a077bf4b8f26677058485421b51f8c8c83,The Greek FREAK,726
1qrle25,images_jpg/1qrle25.jpg,https://preview.redd.it/wenckqw2kkgg1.png?auto=webp&s=fbc898c6446139ea21085b3a579e1dd8306b2340,"""They’re so much more physical and quick than I could have ever imagined. You know that every NBA groupie is elite, but no matter how much you prepare, it’s challenging to be totally ready when you’re actually face to face with them outside the arena.""",727
1qrr2c5,images_jpg/1qrr2c5.jpg,https://external-preview.redd.it/dWFmbm9ndXdybGdnMXUnd2iM4EcxuH8A0L6pyKOv3qlXbhgVlGRUI1eu25ed.png?format=pjpg&auto=webp&s=4d176e71d075a76630326413fd4d71e4942575e1,Add him to the Harlem Globetrotters now.,728
1qr1yyr,images_jpg/1qr1yyr.jpg,https://preview.redd.it/qe33bmlrsggg1.jpeg?auto=webp&s=210fa1dc02c0ff56856321870f3213e9da5378a5,Cooper Flagg is gonna be a superstar,729
1qrrdhg,images_jpg/1qrrdhg.jpg,https://preview.redd.it/hc1n0pphulgg1.jpeg?auto=webp&s=279ed3b6459c4f0d22bd8cd2135e82aa40494178,This is ironic..,730
1qshrq0,images_jpg/1qshrq0.jpg,https://preview.redd.it/2tm93ee4rrgg1.jpeg?auto=webp&s=b5b4e75f4666c62abcc0deb713e8031c4bf37cc1,"😬
Lebron James has more followers alone than all NFL Stars + NFL itself combined. Even Bronny James if we stiched up to NFL right now he would be top 3 most followed people there lol!",731
1qqkdv3,images_jpg/1qqkdv3.jpg,https://preview.redd.it/v40kmqwsncgg1.png?auto=webp&s=34a207bd23091b9e56f3c9c9a3560b333ef898f2,Giannis for Kuminga salary matching is actually quite simple,732
1qqawit,images_jpg/1qqawit.jpg,https://external-preview.redd.it/b2pvbnhub2l6YWdnMegU8qXbBPIdbUJ5Gmd4aByKxPSBQW57PeLxu9GqJFPY.png?format=pjpg&auto=webp&s=d66cb130a559901303becbc8bbfb76b3a76ecc89,All star Jamal Murray,733
1qqdsxi,images_jpg/1qqdsxi.jpg,https://external-preview.redd.it/ZjQxdW05bjJpYmdnMUBPE5A7Ei-RcDV8rmKesxcmHUkv2aaV_hb0zyruHJ5K.png?format=pjpg&auto=webp&s=029abd8f5799066c9f1e5ad4a67267d60380fd55,Medication commercials are always so cringey,734
1qpztky,images_jpg/1qpztky.jpg,https://preview.redd.it/y529169r48gg1.jpeg?auto=webp&s=5d96993e0add115d6d75465e1039544a6c6382bf,[Charania]: It’s official. Per league insider sources Giannis is signing with the LA Dodgers.,735
1qqdn4m,images_jpg/1qqdn4m.jpg,https://preview.redd.it/t0quebm2hbgg1.jpeg?auto=webp&s=1a81a25d5250cbceaa7415a374eaf34f5ea02eb7,"Breaking News on The Freaky Greeky
Bucks trade former MVP and certified Freak to the Dodgers for prime Magic Johnson, also certified as a Freak.",736
1qq0a31,images_jpg/1qq0a31.jpg,https://external-preview.redd.it/eTc5MDczYzA5OGdnMcs8GlOwjmuYjcfwJL-NfmtSmL5cUdD4eyaC78z4xcIp.png?format=pjpg&auto=webp&s=244d89224bf5050e1d9bfafb5fb1eb6ba983c765,Rockets players trying to defend wemby,737
1qpwyhg,images_jpg/1qpwyhg.jpg,https://external-preview.redd.it/dnY4M2t0YmJnN2dnMT7GlgT-04Ysa8a_SscMfldKEIcvjT-T67VhoARhKycU.png?format=pjpg&auto=webp&s=6ac0101a992faaaeff11e22fef2f377a5076c3b1,Bronny gets the steal &amp; the dunk to cut the lead down to 30,738
1qq3clu,images_jpg/1qq3clu.jpg,https://external-preview.redd.it/cnludmVxcWM0OWdnMWTLf3p2Q0e0vltdepmJ0csJc2uZgT6754o60O1StCIH.png?format=pjpg&auto=webp&s=fb8e17614ab82ac0225410feb913618404737739,Can you Name em all,739
1qpoh2p,images_jpg/1qpoh2p.jpg,https://preview.redd.it/se8fbh8oq5gg1.jpeg?auto=webp&s=1155f4a2da457701e7e9b7df9fd149a2d5ccb692,Me just eating popcorn as Doc Rivers calls Joel Embiid the most talents player he's coached days before the divorce with Giannis is finalized. I wonder where he'll get traded too. Personally I'm thinking Miami.,740
1qpxvo5,images_jpg/1qpxvo5.jpg,https://preview.redd.it/jmjlnw02o7gg1.jpeg?auto=webp&s=59f468926838db0720f60f0aef46096540b60605,Hawks Win 4 Straight!!!! For Fearless Wins!!!! AH AH AH AH!!!!,741
1qox0hk,images_jpg/1qox0hk.jpg,https://preview.redd.it/ids430hyqzfg1.png?auto=webp&s=61731edf21bddab63421b7219e0407b8150d4223,Favourite player who's only trying to expose some billionaire's illegal weapons trade,742
1qoql0r,images_jpg/1qoql0r.jpg,https://external-preview.redd.it/NmtsOWh5c2hpeWZnMbuK3hetmxRIzaM2ReJEhweZ0-VhgfRZQAkfR1HxZdr3.png?format=pjpg&auto=webp&s=7b5f55f4166605d170e0490d8812e96a942bc974,Tyrese Haliburton Reveals Hilarious Story About Getting No Playing Time at Olympics,743
1qosfr6,images_jpg/1qosfr6.jpg,https://preview.redd.it/bzlw861iuyfg1.jpeg?auto=webp&s=4a2c4c3c27d41757bcaab3e65865e473de0040bc,used to pray for times like these,744
1qp3ewc,images_jpg/1qp3ewc.jpg,https://external-preview.redd.it/NmVsZnN3ZHU3MWdnMcXDQcksqP8FlB05dIwQ8-LcBUSfr2UI2gS0cU4k3tmL.png?format=pjpg&auto=webp&s=b2b991e91773e06d5c2a6e6fc2ed3ba90a81743a,Clippers W.,745
1qocpx2,images_jpg/1qocpx2.jpg,https://external-preview.redd.it/aW5qcjJ2c3l6dmZnMaSLAJe8ZlppaaYAj3xX69qBWZShfIH4ll-X_6-JppLm.png?format=pjpg&auto=webp&s=8183839a0c4cde97823130fb99180401d0c2078b,"When young Steph and Seth Curry watched their dad, Dell Curry, compete in the 1994 NBA Three-Point Contest",746
1qody38,images_jpg/1qody38.jpg,https://preview.redd.it/klv6gf3r9wfg1.jpeg?auto=webp&s=9ec76ccebf05399db7d786fa02aa8b9e8459feb3,"This isn’t even a meme, there’s a love hotel in Shinjuku called Bron Mode. Bring on the jokes plz.",747
1qnloaq,images_jpg/1qnloaq.jpg,https://preview.redd.it/3rxwzrfh5qfg1.jpeg?auto=webp&s=a6f5ca89f5d18c9357ad14c71ada55bbf7078ee7,Throwback to when Fred Vanvleet crossed up a kid at his camp and posted it on his IG,748
1qngjxy,images_jpg/1qngjxy.jpg,https://preview.redd.it/f8z1z6j48pfg1.jpeg?auto=webp&s=02113fae37954d2d308ae8b1972dd09ca82ae068,Just a reminder,749
1qo5zqm,images_jpg/1qo5zqm.jpg,https://external-preview.redd.it/cGNiOHozeDM0dWZnMSqbf2vBZSiixeEUR34Xb3JDUfmt0bBQmr5IyUxd0ztz.png?format=pjpg&auto=webp&s=a284c4dc829143654fe9e53cccd0ff4e04349c4b,Luka Doncic last 4 games: 37.3 - 9.8 - 10.3 - 68 TS%,750
1qnhwll,images_jpg/1qnhwll.jpg,https://external-preview.redd.it/Z3Vkd2p2NW1ocGZnMY7NXDzj0zwpUtYg8B9FWr2bknOJayO2dewn8u92MJN1.png?format=pjpg&auto=webp&s=f99df9b5fa2b38f5c77aa5539ea643aebb91cd42,Cleanest Lu Dort defense,751
1qnj7s1,images_jpg/1qnj7s1.jpg,https://external-preview.redd.it/eHF5dzUyeTZxcGZnMbDnfKBz7_1lE4UxgKTYjU1FYnDKBcAbYpY8cEIx0Dld.png?format=pjpg&auto=webp&s=add2bff7cc84ec4ba7cdab90303eaf95e68a80d1,Lakers pre game celebration with Luka,752
1qn7fh7,images_jpg/1qn7fh7.jpg,https://preview.redd.it/q28uyw1wrmfg1.jpeg?auto=webp&s=bb99af31f8fafc64cfff2009c7677ee488eb5966,actually Luka is really one of the best trash talkers in the game😆😆😆,753
1qmmm20,images_jpg/1qmmm20.jpg,https://external-preview.redd.it/b2Y0NmN4NzhvaWZnMZDPmrtYBJw3wZUALW3Ns73XIMkcbaZ613gVa9jHj0A-.png?format=pjpg&auto=webp&s=210b971414872c4a183d200122f912011c611f4a,Guarding prime Harden be like,754
1qn6sxm,images_jpg/1qn6sxm.jpg,https://preview.redd.it/fgpm0ph6mmfg1.jpeg?auto=webp&s=6c12230198fea126ef474c559cf7663044334bd2,All I see when I look at Doug Christie is Handsome Squidward.,755
1qnssak,images_jpg/1qnssak.jpg,https://preview.redd.it/0t1bob8pcrfg1.gif?format=png8&s=8a9c1a5faf0eefc7610ef6ca760faa8a1962c840,Three Straight Hawks Wins!!! On The Road To Boston!!!,756
1qmudvt,images_jpg/1qmudvt.jpg,https://external-preview.redd.it/dWNmcTg3cGkxa2ZnMY1T8a6IvlK3xm-UpovVAzBL7I3Y9jJr9bzdWSjmdVup.png?format=pjpg&auto=webp&s=7dc2874c544b6f071df5505de5c1863535cda2f2,Fan wearing KD jersey hears it from him,757
1qmxyts,images_jpg/1qmxyts.jpg,https://preview.redd.it/4rbtis6lpkfg1.jpeg?auto=webp&s=8267b8b80b3b27bb6c146a1a5374e30ee35ade78,DeAngel Ayton,758
1qnqyf4,images_jpg/1qnqyf4.jpg,https://preview.redd.it/yob3n7q01rfg1.png?auto=webp&s=6e377334d032897703a81dd30471e1aec4994933,"I got the perfect team in a random nba lineup generator🤣 This is only the best I’ve gotten so far.
I feel like it is the best so far With ANT and Joker but I feel like Hunter Tyson would be Ideal (Just Kidding!)",759
1qmauw1,images_jpg/1qmauw1.jpg,https://preview.redd.it/64d0xjpypffg1.jpeg?auto=webp&s=65b6d6cb442181fe73a6a3457a6c291c3d7ac506,Are these guy from Switzerland😂,760
1qmg03n,images_jpg/1qmg03n.jpg,https://preview.redd.it/sq8at1t96hfg1.jpeg?auto=webp&s=04b35ebf7e9676c75fe56063515020d8363c4332,Can someone please tell me what stat this is?,761
1qm5arg,images_jpg/1qm5arg.jpg,https://preview.redd.it/a44rnzvneefg1.jpeg?auto=webp&s=108c5dff551ecd85eaec5cc149f6b55de0989db8,"Meme request, looking for the lakers “daddy im open” meme w bronny 🙏🏽",762
1qlny58,images_jpg/1qlny58.jpg,https://preview.redd.it/id6w10po1bfg1.jpeg?auto=webp&s=2ed2a1267ce92f3a4481b7b66cc2af7cb36c5dc1,Thoughts on my dream team?,763
1qlxixu,images_jpg/1qlxixu.jpg,https://preview.redd.it/5kt62m5iucfg1.jpeg?auto=webp&s=85cbc3fe3ba66416bdfc8d59a0529e4b547c059c,Did Genghis only play against milkmen and plumbers?,764
1qltgw8,images_jpg/1qltgw8.jpg,https://preview.redd.it/78sza24x3cfg1.jpeg?auto=webp&s=87b9c3b41cfc1352a3c7f05c913c2dfecef6c818,Brandon Miller apparently asked a stripper to teach him how to twerk,765
1qm3ja8,images_jpg/1qm3ja8.jpg,https://external-preview.redd.it/dnQxMWJtcnkwZWZnMYUmcmiQp38KRw9z5L3Z2U3vO1oViBZWPLgu-BuEodZ4.png?format=pjpg&auto=webp&s=c3da90857321ca00f268c06db20a4731fd73806b,CMON MIKAL 😩,766
1qmcdtv,images_jpg/1qmcdtv.jpg,https://preview.redd.it/qpbrlelh4gfg1.png?auto=webp&s=2817e6fddc4a6977fddab11d76e0a6b7bd78ed7b,Guys why they hate me,767
1ql2i49,images_jpg/1ql2i49.jpg,https://preview.redd.it/rpck1k1sv5fg1.jpeg?auto=webp&s=d61237a7c642b89cd5028e27f8a7c3f78150dd9d,It’s been rough 🥲,768
1qlfbxp,images_jpg/1qlfbxp.jpg,https://preview.redd.it/xhuskjeuo8fg1.jpeg?auto=webp&s=98932b56658eb73d521567cd76c6be1d2d0e9af3,Giannis and the Bucks,769
1qlgrba,images_jpg/1qlgrba.jpg,https://preview.redd.it/pimaswf539fg1.png?auto=webp&s=34207b87cf32f5e56b4eedc8cadc5a11850fd862,Clippers bros???,770
1qlfmw8,images_jpg/1qlfmw8.jpg,https://preview.redd.it/rlzclbxwr8fg1.jpeg?auto=webp&s=b338f0fde238bce932fafdda56aea9314b7ddb16,"Despite the loss, Lu Dort shows us what he’s made of, and exactly why he’s earned his place on a championship roster
2 points

3 rebounds 

1 assist

1 turnover 

2 personal fouls

1/9 shooting

\-17 bpm

All managed in a gruelling 35 minute performance.",771
1qkux81,images_jpg/1qkux81.jpg,https://external-preview.redd.it/ZmhmcWc5aTNpNGZnMcUCUaKIRPjNvpuNZbcGrg9ta2v5a255p5PCH3XA8fXJ.png?format=pjpg&auto=webp&s=20a5a7084e53e459147ad8db74cab64e5dbda3bc,Luka is actually an underrated defender,772
1qli3uv,images_jpg/1qli3uv.jpg,https://preview.redd.it/h3ffa0u2h9fg1.jpeg?auto=webp&s=caf69e877e8a03f6c74b2392239614a9fb27e163,"When is the parade?
No one in r/Dodgers got my reference 😭

&gt;!Ok, I know Jokic said ""When is parade"" instead of ""When is *the* parade"", but it's close enough lol.!&lt;

[Original post](https://www.reddit.com/r/Dodgers/comments/1om99dc/when_is_the_parade/)",773
1qlczy6,images_jpg/1qlczy6.jpg,https://external-preview.redd.it/MmRiY21hd3EzOGZnMZkeoLUY1ZVnJS2riQCzbSEkF1TgTNsvSpk7v1FPYuWG.png?format=pjpg&auto=webp&s=1763816d1c7be2fbf1dc3746979c58186ab95058,WHO WAS GOING TO BEAT GOLDEN STATE'S RECORD??,774
1qkfzp9,images_jpg/1qkfzp9.jpg,https://preview.redd.it/mky5q91tr0fg1.jpeg?auto=webp&s=3fb5d7ad1da0454e6a2b0662455847ad09c6e6cc,“Mike Dunleavy Jr. selling 29 other teams on Kuminga”,775
1qkivni,images_jpg/1qkivni.jpg,https://external-preview.redd.it/cWh1eHdmMXlnMWZnMVdYbbvx8SdjbLibz272ECgv1n9oiRt2mrRLSjV7LGsl.png?format=pjpg&auto=webp&s=92b2262a0b329ebdf08418255ee38c47fd9865e9,"Luka out here ""Shaqtin' a Fool"". Turns down wide open 3 ball late in 4th quarter 😭",776
1qjnw06,images_jpg/1qjnw06.jpg,https://external-preview.redd.it/dnpyaXFyMTRwdWVnMUkNces7nFkaAevwvgJX93OW3Mg1x-Pul8UHPPMbYPsM.png?format=pjpg&auto=webp&s=296bccc63fb26064270be018b8c5445cb8c0fddb,what he's doing is very intelligent,777
1qjkz11,images_jpg/1qjkz11.jpg,https://external-preview.redd.it/czdocm53eWl4dGVnMV6wcS_U6cNoKhp-KeeIyfoIVDdunvTXCaZbbrED_GdU.png?format=pjpg&auto=webp&s=4f6a7caeb20bc2bade7798b33039def66fdc685a,"Yo, Giannis, wtf was this?
Yeah, tough guy. Take it out on our 4th string forward. Bet that feels real good. Dumbass.",778
1ql3jef,images_jpg/1ql3jef.jpg,https://preview.redd.it/ykwoq7ls26fg1.jpeg?auto=webp&s=07360f3da564a25fa9d1ac233eb2e79864136f42,"any thoughts on this😭?
saw this in a tiktok comment section and was wondering what other people might think about it. personally i dont really agree with it",779
1qkjjks,images_jpg/1qkjjks.jpg,https://external-preview.redd.it/MzdlYWFxb2NuMWZnMcoqGqxMwBxyLosN0igH4Cgxj3ReTXtPS-7kNqmDPlc-.png?format=pjpg&auto=webp&s=b06165f68034b07a6ee912f56e037023a2637c5f,"This was pregame y’all
Please stay until the end",780
1qjidm5,images_jpg/1qjidm5.jpg,https://preview.redd.it/eoj1uc54cteg1.png?auto=webp&s=daab3eac45c7661a8149f9559087b0944d60fa81,We're back,781
1qinxd8,images_jpg/1qinxd8.jpg,https://preview.redd.it/i61awcfapmeg1.jpeg?auto=webp&s=9ff8cb015368ec98e9a931d0b41e73b0f079e1b1,Jamal Murray everytime he plays the gotdamn Lakers 🔥😂,782
1qjgwak,images_jpg/1qjgwak.jpg,https://preview.redd.it/ggto7itd0teg1.png?auto=webp&s=a2e159cf6a9514f07f992acf161fd69322493afc,How did bro know,783
1qiphik,images_jpg/1qiphik.jpg,https://external-preview.redd.it/MGdyYXd1YTkzbmVnMRTNC4lzrbXafgBCRgzVNBDJHJ14vNfCKlQw0wZKb9KU.png?format=pjpg&auto=webp&s=e0e7d7b428d12a0c2c31f8b81e1fc6d388c30f11,Jamal Murray in the 2nd half against the Lakers 😭,784
1qjz4le,images_jpg/1qjz4le.jpg,https://preview.redd.it/3tjha14lgxeg1.jpeg?auto=webp&s=0890bb57e36cbcfb3edd94a375779a7d0f6e57de,"Pure hypothetical hate if you want :)
Jaylen Brown and Luka on the same team would be an immediate 3 peat dynasty.

Offensively they would flow like butter and Jaylens defense is exactly what Luka needs next to him. Perfect duo. (They'd have better chemistry than Tatum/Brown too)

""Yo Rob send Reaves for Brown just heard the C's might fire their GM and hire Nico""",785
1qiro58,images_jpg/1qiro58.jpg,https://external-preview.redd.it/aDI2MDlmbDVwbmVnMTre9L-Y39Pzi328ErwuA4UIfCQOENZBiRuO5bNL3ihk.png?format=pjpg&auto=webp&s=134e2345a3d68022eba97eb836d4448b0cd3b7b9,LeBron the GOAT 💯,786
1qi8u8b,images_jpg/1qi8u8b.jpg,https://preview.redd.it/oqmprv98qjeg1.jpeg?auto=webp&s=57b5baa3b41a06b80ded757b700a7eea9702ba32,Knicks have lost 9 of their last 11 games.,787
1qi64ot,images_jpg/1qi64ot.jpg,https://preview.redd.it/pt6qrbt99jeg1.png?auto=webp&s=e49de5ebfb9deca4a5f044c64c43ef4f2f382fae,"Someone said it’s Him, Ryan Nembhard, and Strawther combined",788
1qhsg76,images_jpg/1qhsg76.jpg,https://external-preview.redd.it/OWphbGd5cWR3ZmVnMRdC0B1982YYsUJgwBrGFsJEcviHWGe4X_QmLt9LTmwc.png?format=pjpg&auto=webp&s=ba620e5d03fae86d009e1c3c01f77795ce6fa421,He was almost free 😭😭,789
1qi9s7o,images_jpg/1qi9s7o.jpg,https://preview.redd.it/w5rb6pp2wjeg1.jpeg?auto=webp&s=e62090c7b65735d68da9befea134f75865a8ec95,Devin Booker when he plays at MSG,790
1qhope0,images_jpg/1qhope0.jpg,https://preview.redd.it/fu2bb1081feg1.png?auto=webp&s=778a8a48de9d0f86489d10ad458bc084c7a8ea19,"Am I just crazy, or....?",791
1qi7g1t,images_jpg/1qi7g1t.jpg,https://preview.redd.it/a779fg1mhjeg1.png?auto=webp&s=a37e37f9e359c3a6cd1505603d4183a06faaf9a0,"The Jazz announce next year they are for sure, totally gonna try to win games. For real this time.",792
1qi07qn,images_jpg/1qi07qn.jpg,https://preview.redd.it/ljqod75b3ieg1.jpeg?auto=webp&s=f4c1357df9705194817ca51ae136b2d809c97301,MIKE BROWN,793
1qh99gg,images_jpg/1qh99gg.jpg,https://external-preview.redd.it/bmRlcWNibDc0Y2VnMYXUHfHfEo1sVRLVRAay8kkEphPeoQhWF1z2iGD2GW79.png?format=pjpg&auto=webp&s=45992e2fb6148a92c90f5db2c5c7fbc8df227b9f,"I think I just found the only way to make Luka Doncic actually run back.
When he doesn't get the foul call, he just chases the ref to complain. If the ref sprints, Luka sprints with him. It’s basically physics.",794
1qh84ne,images_jpg/1qh84ne.jpg,https://preview.redd.it/xsl6de17xbeg1.jpeg?auto=webp&s=e6e282b4dade1e325efcfd310dfb597f2615dbe0,Watching Ant V Wemby,795
1qhp4wk,images_jpg/1qhp4wk.jpg,https://external-preview.redd.it/cTE4cmplZHI0ZmVnMVy-_qU6OkiBUiuTqO_OW-XoZLn_oMHCGwnRnltz9xah.png?format=pjpg&auto=webp&s=81fed64e701a679ebd2b5147504060773f62120e,“ethical hoops”,796
1qh980d,images_jpg/1qh980d.jpg,https://preview.redd.it/14kwtfm04ceg1.png?auto=webp&s=1fa58270d58def9beed157386f3ee9244a9c5027,You love to see it,797
1qhr17d,images_jpg/1qhr17d.jpg,https://external-preview.redd.it/LBGtA35EZWU3wKpk6v14p44I5FWY4KcbV76wzmux8Kk.gif?format=png8&s=b477227cd43c256a2685891370500f9226492539,:-p,798
1qhl18s,images_jpg/1qhl18s.jpg,https://preview.redd.it/rz3ntb2x8eeg1.jpeg?auto=webp&s=221cc5e606ed493afac968b81ac73d74e21f3e97,Ty Lue drawing plays:,799
1qgvztq,images_jpg/1qgvztq.jpg,https://preview.redd.it/24m1h4snq8eg1.jpeg?auto=webp&s=16b48b11839e6c8d8e3d2fdddf446db6586a3dba,Nikola Jokic is finally trying his self after 12 years 😂,800
1qho2cc,images_jpg/1qho2cc.jpg,https://external-preview.redd.it/cmx5bmxleG92ZWVnMTyr7KTXz4ZkH8DILBdTPYbsNiM6bB3yae1IOdLnd6it.png?format=pjpg&auto=webp&s=2d93e4a40154a11889c897bc654d0643cdf5401d,Matt Barnes just brilliantly explains why Mike Clown is not a good HC. Watch this because this is happening right now.,801
1qgxjcu,images_jpg/1qgxjcu.jpg,https://preview.redd.it/vh1vlc2jb9eg1.jpeg?auto=webp&s=0fe4a3fe1ddf984bdcb4daab4121d025ae8cd3ae,yall rem when kcp had to wear an ankle monitor😭,802
1qgfe84,images_jpg/1qgfe84.jpg,https://preview.redd.it/yfzsw02vc5eg1.jpeg?auto=webp&s=3f600ba93791eae8d6960ee3703280c2cf368d4d,Wemby on his knees is tall.,803
1qfxfpl,images_jpg/1qfxfpl.jpg,https://preview.redd.it/tlga04q601eg1.jpeg?auto=webp&s=422bac3f9b55372eb19a4f7bdccd2b820cea123f,AD prepping,804
1qgmbkj,images_jpg/1qgmbkj.jpg,https://preview.redd.it/9mtzgmnro6eg1.png?auto=webp&s=b115574f2ab3f2dc2c97aad3f6bcc2a34a33f9a2,"Today I remembered the greatest internet page, that exposes Jordon's menace and overrated nature",805
1qfiay8,images_jpg/1qfiay8.jpg,https://preview.redd.it/3svgmnxiwxdg1.jpeg?auto=webp&s=0784d8b659fae58ade5122ed7cf45da05f667266,Lmao 🤣🤣🤣,806
1qfyu61,images_jpg/1qfyu61.jpg,https://preview.redd.it/qnkx7nxbc1eg1.jpeg?auto=webp&s=fe3e4a25ac10f574587bfbb6b7c4c5550fe6db01,Jamal Fucking Murray,807
1qfspp8,images_jpg/1qfspp8.jpg,https://preview.redd.it/pu5zipk1yzdg1.jpeg?auto=webp&s=33fd349e76ebc1ff3687aca467ca1da919980643,KD disgusted after Gobert’s air ball ft’s,808
1qfycir,images_jpg/1qfycir.jpg,https://external-preview.redd.it/dmU2Y3EwZnA3MWVnMT6wvNlL4VF0P42NmTnmx8-7v_oZStEzjKosfTQhoe5D.png?format=pjpg&auto=webp&s=5eb2ca58f85abb0e381626a4a7183c88ebe1744f,Sexton tries to guard Steph to the tunnel,809
1qfqznx,images_jpg/1qfqznx.jpg,https://external-preview.redd.it/enZyY3hhMDJsemRnMcIrDXKXzuK7bs6xWyuoBvEpOkZsaRH_Bd5_LnyMkm3N.png?format=pjpg&auto=webp&s=2c227a7bfe662ac417000687fcacb31c6900c21d,Flopping is getting out of control,810
1qg0bz9,images_jpg/1qg0bz9.jpg,https://preview.redd.it/fxo646nyp1eg1.jpeg?auto=webp&s=b27a3090c23bbda3906d1ec7f489ca51eb28257e,Maybe give Caleb Love a contract? 🔥 🔥 🔥,811
1qfq6x2,images_jpg/1qfq6x2.jpg,https://preview.redd.it/tn3rsyu7fzdg1.jpeg?auto=webp&s=0340684a5124486b702596a9cbcd2e10b624b149,AD,812
1qfxttb,images_jpg/1qfxttb.jpg,https://preview.redd.it/mnojeall31eg1.jpeg?auto=webp&s=37bea826f6fbd764b2f950f45a921daa76ab4d65,Clippers in a nutshell,813
1qffwtz,images_jpg/1qffwtz.jpg,https://external-preview.redd.it/bTV4bThvODNneGRnMUGL_Actctbpek5oExc-T6eL65sss8SK1r7qq74EIJiy.png?format=pjpg&auto=webp&s=24e52b2247482b83da1936c96bb64119979fe319,The real freak,814
1qelpu5,images_jpg/1qelpu5.jpg,https://external-preview.redd.it/N3hkOTl5Z3h0cWRnMcSuZw8eQA0erkyqYE1KsiwmT4BPMYsyz-LhtK4PIqK_.png?format=pjpg&auto=webp&s=bc44d9b39eb356393d1a07e140957fd2f6a176c5,Heated rivalry,815
1qenern,images_jpg/1qenern.jpg,https://preview.redd.it/045grl7m4rdg1.jpeg?auto=webp&s=c3f4c14add76b641960214a03f5136e44f6aaedf,Durant+Shai 😳,816
1qf5i6o,images_jpg/1qf5i6o.jpg,https://preview.redd.it/ki4qg5nfpudg1.jpeg?auto=webp&s=42d0c9a304d1444e6ca24b27c1d891477b8322bc,Investigate the nba,817
1qf4dyo,images_jpg/1qf4dyo.jpg,https://preview.redd.it/0a99eii2fudg1.jpeg?auto=webp&s=251bfd1204496226ccd112c7aa34af58e1054766,Deandre Hunter is Flop Embiid father,818
1qee295,images_jpg/1qee295.jpg,https://preview.redd.it/i5rzd97i9pdg1.png?auto=webp&s=3446d119bcad313425e2664cf03894d210ccbb65,"Miles Turner when his point guard isn't Haliburton
MILES TURNER WOKE UP AND FELT DANGEROUS TONIGHT🔥🔥  
5 points🔥🔥  
2-7FG(1-5 3pt)🎯🎯  
3 rebounds💪💪  
\-23 +/-🐐",819
1qegxl6,images_jpg/1qegxl6.jpg,https://preview.redd.it/1b8vopi9ypdg1.jpeg?auto=webp&s=eec380c5da67df0a01c3dec3857b0eba04116439,Curious Case of LeBronbenjamin Button,820
1qdyjm8,images_jpg/1qdyjm8.jpg,https://preview.redd.it/5z0kcxr9eldg1.png?auto=webp&s=2a551bd126c237d745ef066f1515d03a1eff54c5,Victor Wembanyama Goes Bald After OKC Loss,821
1qer0bz,images_jpg/1qer0bz.jpg,https://preview.redd.it/qs3up589srdg1.png?auto=webp&s=a7d4e5d5790942b8c13af320d502c80abf3bce3a,"Kawhi continuing to give exactly zero fucks
He made the shot, if you're wondering",822
1qe8qbz,images_jpg/1qe8qbz.jpg,https://preview.redd.it/n2l6n22xpndg1.jpeg?auto=webp&s=81130c96de5c613cd1c2a81198408a8b06abd573,UNBELIEVABLE DUNK,823
1qe5xtc,images_jpg/1qe5xtc.jpg,https://preview.redd.it/tyhztspszmdg1.jpeg?auto=webp&s=cdb59f3a279059b07a22ec256f8f6cbc6d7a500b,My god.,824
1qe4mup,images_jpg/1qe4mup.jpg,https://preview.redd.it/klsyxr0womdg1.jpeg?auto=webp&s=5a03641ee8b283866870e33026d11ec936577ffc,Chet gives shirtless interview on Prime,825
1qeb6cp,images_jpg/1qeb6cp.jpg,https://preview.redd.it/ptixfjo0godg1.jpeg?auto=webp&s=bb1445f951272712ce222884aca79920e9ac589e,Me explaining to my friend why the coach should’ve run a pick-and-roll… and then me at rec league,826
1qd7drd,images_jpg/1qd7drd.jpg,https://external-preview.redd.it/YjRsbG45ZTdkZmRnMa1TmeRsX-XO9A552pM7lHl4TpCg-BEoQ419C4c2kWTk.png?format=pjpg&auto=webp&s=792e9770150f4faa3d7ee09946bcba67dd33ec86,"It wasn’t travelling, it was a journey",827
1qewyfz,images_jpg/1qewyfz.jpg,https://external-preview.redd.it/dzhqbmRja2d3c2RnMb5N8X4sGKBATGBywhN4cNglZdoZS8hTDy3CHpHzBnm9.png?format=pjpg&auto=webp&s=41b32358ede0f1f65d4172d2d8af79db75791ea6,"Naz Reid cooking KD.
Naz Reid cooking KD in 4k",828
1qe3h1t,images_jpg/1qe3h1t.jpg,https://preview.redd.it/i7vt6t0ofmdg1.jpeg?auto=webp&s=000e6768be265b7b575cdfab71cf7b969f03572e,"Thunderstruck 2.0?
Kevin, you can’t do that.",829
1qenc4k,images_jpg/1qenc4k.jpg,https://preview.redd.it/rea4n1jn3rdg1.jpeg?auto=webp&s=a55d1822b16d87e0c5f941f3502008c4ecbb670c,"Holistics
(Via *Lightning* \-Spanish ACB Clippers Forum-)

*^(Addedit: He tells me he saw it at RealGM)*",830
1qer8nt,images_jpg/1qer8nt.jpg,https://preview.redd.it/h0pgi3rytrdg1.jpeg?auto=webp&s=6b427f4ca1e850c389fde21fb1e3f6bdf07f5ca2,Did yall ever think that Spencer Jones looks like Yakub?,831
1qdlyxd,images_jpg/1qdlyxd.jpg,https://external-preview.redd.it/eXdscDExcGwzamRnMRzgA2UMmayADyX4DKzl_meR45iEfIbsgGG1kwOBS85J.png?format=pjpg&auto=webp&s=969e96462d9f5bba745e5b26be175137e44cfcd5,When the shrooms kick in at the worst possible time,832
1qdv7v8,images_jpg/1qdv7v8.jpg,https://external-preview.redd.it/cXdlbWFtMm9ya2RnMXfW7KQxzl2OwIFthPa_yhleaLRjcCJZ_EtZr9bdvVe3.png?format=pjpg&auto=webp&s=8f9c053d64435d9236b48af223409b531a4ba35f,Westbrook dagger off the glass,833
