sample_id,image_path,source_image_url,text,raw_order
1rbkxlt,images_jpg/1rbkxlt.jpg,https://preview.redd.it/8ckraemhk1lg1.png?auto=webp&s=73c92c3fb5373a18411820e4ff25bc90b31df654,Everytime I hear Mr. Dickerson I think of this happening,490
1rb8k4o,images_jpg/1rb8k4o.jpg,https://preview.redd.it/d26tp4up7ykg1.jpeg?auto=webp&s=be383c4d01c55cb0ef0df53d5c87f638341035b7,With no trade clause,491
1rc6me1,images_jpg/1rc6me1.jpg,https://preview.redd.it/yjrixdl4z5lg1.png?auto=webp&s=39ec5c73a051a07eb8db3e841f044b57bf79900a,Teacher can I use the bathroom?,492
1rc7oni,images_jpg/1rc7oni.jpg,https://preview.redd.it/e6qrti4j86lg1.gif?format=png8&s=772bb2915f30f7aac9aeced4ae3f61452da80195,One Opulent Atl Comeback Win!!!,493
1rbb9n6,images_jpg/1rbb9n6.jpg,https://preview.redd.it/muh3rlatuykg1.jpeg?auto=webp&s=2df62c58c3206d9a6d948370de878dedb4bfba82,When the Ref refuses to call a foul after every single play 🫲🤡🫱 💅,494
1rb92mv,images_jpg/1rb92mv.jpg,https://preview.redd.it/3euf16tzbykg1.png?auto=webp&s=09d720cc4820d710849038db762ea9e21842d13f,"This pic sums up Kuminga pretty well
Bro is so lazy that his whole signature is just ""JK"" vs an NBA legend Dikembe taking his time and effort to make sure any product that has his name on it has a quality",495
1rbgwwu,images_jpg/1rbgwwu.jpg,https://external-preview.redd.it/ZHk3N3FnazNmMGxnMVkDee4n05OAyJQoW8FM1vMJTIDCILktB31EJkZxgkl8.png?format=pjpg&auto=webp&s=1b830ee22ace2960d5d943d95d228ffc1f7e5838,I thought this was just a random Lakers fan casual but it's actually the House of Highlights social media manager. NBA discourse is cooked,496
1rbago4,images_jpg/1rbago4.jpg,https://preview.redd.it/f1gsxe9tnykg1.jpeg?auto=webp&s=3f07bccd315e2bf15ed003ae74d9e079bd0cae48,go new york go new york go,497
1ra5b1j,images_jpg/1ra5b1j.jpg,https://preview.redd.it/4m79difucpkg1.png?auto=webp&s=0ae0424593e5ad9931efea4abb92a44f07b7eb26,OKC 🤝 DET,498
1r9xz6l,images_jpg/1r9xz6l.jpg,https://preview.redd.it/2x51xrw91okg1.png?auto=webp&s=a1af9beb7c83b2f039b091d8d043808a03eb85cd,"""How bad are the Kings?"" 
 This bad...",499
1ra0isj,images_jpg/1ra0isj.jpg,https://preview.redd.it/vakzfkxbiokg1.jpeg?auto=webp&s=77ebcf77890c3023cc8016be1f23caa80a52ba88,What would you do if you were in this position,500
1ra77g0,images_jpg/1ra77g0.jpg,https://preview.redd.it/4veoir9eqpkg1.jpeg?auto=webp&s=bcf769a8e0c223828f760c8d83a9944b94de1d77,Lalalalalala can't hear uuuuu,501
1ra053x,images_jpg/1ra053x.jpg,https://external-preview.redd.it/czlncjc3dXVmb2tnMaXmCuH3jo3QgilTp3bDRKOLYkstOXbc_iK7dUH4h6wZ.png?format=pjpg&auto=webp&s=175aa65f3c6baf305b527668ae9022d07772cfff,Jimmy Butler peeped the setup 🤣🤣🤣,502
1rakexu,images_jpg/1rakexu.jpg,https://preview.redd.it/702r0d01qskg1.jpeg?auto=webp&s=3ec85c89edbe6f10e818cca07dc0b5e3fad87c87,Head Coach Darvin Redick,503
1rabau3,images_jpg/1rabau3.jpg,https://preview.redd.it/ik4cyx90jqkg1.gif?format=png8&s=9d419c83c0c1411d46e78d73477f29926669f23a,"I ask my girlfriend to name the most famous nba player ever
she said tristan thomson just come on!!!!!!!!!!!!!!!!!!!!!!!!!!!!!!!!!!!!!!!!!!!!!!!!!!!!!!!!!!!!!!!!!!!!",504
1r9z76q,images_jpg/1r9z76q.jpg,https://external-preview.redd.it/Y214c2s2cnY5b2tnMYr31eYUdLgDKJolKQsFaFq9Tg3i9qO6-WWy6Rd6WukE.png?format=pjpg&auto=webp&s=c78f029b05f4007f1f60f393d20882b9b10c210b,"He already putting that chair through enough, dawg. Damn",505
1r9ygwp,images_jpg/1r9ygwp.jpg,https://preview.redd.it/rztikn515okg1.jpeg?auto=webp&s=16d28f8c2ecf5801180642be6ad0a7fc6de8b7c2,Jokic Since coming back from injury,506
1r9wnj8,images_jpg/1r9wnj8.jpg,https://external-preview.redd.it/M3lxMWx2c2VzbmtnMb9vmtsysX3tIZ7DTqRHUfPJ6ZXREmyJo9Bf-nce5rMP.png?format=pjpg&auto=webp&s=ffb57b66c98be18367fb3a7247594930996ca169,When the Knicks lose their 3 games against the Pistons by 84 combined points:,507
1r9cm5b,images_jpg/1r9cm5b.jpg,https://preview.redd.it/yox1krjnvikg1.jpeg?auto=webp&s=abbfa25a5ad7bbe6f5bfdd3b4439cc21231f5c91,"""NBA is dead"" ""No one cares about it in USA anymore"" ""Its only watched globally"" :More than 46 million people in the U.S. watched NBA All-Star weekend across NBC platforms and ESPN, the most in 24 years and more than triple last season
While its true that NBA is more watched globally cause of population difference obviously, it is absoluetly not true that its dying in USA or that no one in USA watches it...",508
1r9nhz5,images_jpg/1r9nhz5.jpg,https://external-preview.redd.it/ZDFkeHducmpibGtnMX4ZVe89dbmyQBlzXqF1ILLvRyaDQ11yb0mn8tzfH05m.jpeg?format=pjpg&auto=webp&s=85afbd8a8c044288227caab2034895d09b6f48c5,LeVessel,509
1r9sh3y,images_jpg/1r9sh3y.jpg,https://preview.redd.it/i1w29sd9smkg1.png?auto=webp&s=aa4c56000120902618b94242462a090ac8e0a7ba,"In the wake of the KD files, I found Shai, Luka and Deni's joint Reddit burner account",510
1r9jzqy,images_jpg/1r9jzqy.jpg,https://external-preview.redd.it/M21oeHlyaHNma2tnMVWYlK4rAyKD9bAP2tiBNBbZulboy2eTV3fxkVh-OQ5-.png?format=pjpg&auto=webp&s=69c5ebbebdac33d7ffd46d7181f62ba241b97563,Why didn't the Knicks beat the Pistons? Are they stupid?,511
1r9nt09,images_jpg/1r9nt09.jpg,https://preview.redd.it/528qzzzoelkg1.jpeg?auto=webp&s=6f39cf9ef9a9b58c652a9d2cf8164a5934730560,How I’m feeling rn,512
1r8fjnk,images_jpg/1r8fjnk.jpg,https://preview.redd.it/bzv8y7m6kbkg1.jpeg?auto=webp&s=16bbc054d6379e47df8847e98fa5117f587d976f,How did everyone come to view KD after the files,513
1r8i2xe,images_jpg/1r8i2xe.jpg,https://preview.redd.it/jyftlbse1ckg1.png?auto=webp&s=76aafe940733858f0ef2cf1a1a59ee3cec071bb7,"Zaccharie Risacher picked #1 between Antman, Cade, Flagg and Wemby...",514
1r8dlsq,images_jpg/1r8dlsq.jpg,https://preview.redd.it/bjl5bif77bkg1.jpeg?auto=webp&s=68ae3dbe840d9853a2a886583c144bc1fd3a693f,KD isn't here for Twitter nonsense. He's innocent.,515
1r87ocd,images_jpg/1r87ocd.jpg,https://preview.redd.it/3v5n6ync5akg1.jpeg?auto=webp&s=f0ea6be1ea2e152c97e48122a2c744fea493c5a4,How the Spurs feel being the best team in Texas by simply not shooting themselves in the foot,516
1r854r1,images_jpg/1r854r1.jpg,https://preview.redd.it/3qf19f1tn9kg1.jpeg?auto=webp&s=8367fee507d8355b7e784c9c90cc83e5c0fb4217,You just know Ben Simmons bricked that shit😅,517
1r8hz73,images_jpg/1r8hz73.jpg,https://preview.redd.it/bws5y5cp0ckg1.jpeg?auto=webp&s=7c362dd1b7e442eac6ec8de80309736781f1e37c,"When your name isn’t in the KD files
Seriously though, anyone else surprised by KD’s beef with Kerr and Curry, while dray got left out? I seem to recall the narrative surrounding KD’s departure was drama centered around dray, yet only Kerr and the “light-skin” (curry) were mentioned??",518
1r8nmcs,images_jpg/1r8nmcs.jpg,https://preview.redd.it/q6h66b9m8dkg1.jpeg?auto=webp&s=c6a9932cf538b0da855c7d6ff1247102cdd25fa2,“Draymond Green is guarding you” if ykyk,519
1r8m2zi,images_jpg/1r8m2zi.jpg,https://preview.redd.it/420cp8vuvckg1.jpeg?auto=webp&s=34e770059e0c62e61fd25d88c95026125754205e,"""Dad how good was pre injury 2025-26 jokic""
I mean he's still great post injury but before his injury he was a different type of basketball player.",520
1r7pll4,images_jpg/1r7pll4.jpg,https://preview.redd.it/gqnozi45r5kg1.jpeg?auto=webp&s=d24a8f1381a460bbaec6c8cfb9616aa0f5d13d7f,Where does Triple Double Cocaine Bear rank all time?,521
1r7n2xy,images_jpg/1r7n2xy.jpg,https://preview.redd.it/lih6411y75kg1.gif?format=png8&s=028d38091dbef6e616ffdb62c3b6c3bb6fabb019,Jabari Smith Jr. in the locker room after seeing the messages,522
1r785bs,images_jpg/1r785bs.jpg,https://preview.redd.it/048m8w0nj2kg1.gif?format=png8&s=7139790de4f5a748894df20691bd523a5bc63051,Jabari Smith Jr. in the locker room after seeing the messages,523
1r891kt,images_jpg/1r891kt.jpg,https://preview.redd.it/5p3nyfvwdakg1.jpeg?auto=webp&s=d4c59e43a3803745db8f68928000b38ebe6bf7bb,"What does MJ &amp; world’s largest company founder Jensen have in common?
UNBELIEVABLE! If I had a Time Machine… I know exactly which date to travel back to. They aren’t born on same continent though",524
1r7irj0,images_jpg/1r7irj0.jpg,https://preview.redd.it/uh8ntznsd4kg1.jpeg?auto=webp&s=d499b8f8235267bda85ea742d0e9a60da0c29ae1,😂😂,525
1r7vw3o,images_jpg/1r7vw3o.jpg,https://external-preview.redd.it/dWRtM2s1M285N2tnMdoZ97_1Gb6ou-a2MeLcfrxmF9_Gt1EkF44URrQOtN3H.png?format=pjpg&auto=webp&s=74fcd43031db1cff855e8d13e081277db98e8bdb,Tf you mean KD got his own files now,526
1r7tr6w,images_jpg/1r7tr6w.jpg,https://preview.redd.it/oag7hxuso6kg1.jpeg?auto=webp&s=b8b80e7f8ce3c53e93c1212f8d33e6ae0bef42b2,"KEVIN DURANT FILES
kd-whispers-vault.lovable.app

Copy and paste into google and you will be able to see what Kevin Durant has been saying. 

Press “Evidence Room” and you can see the posts that Kevin Durant has posted throughout the group chat with also other information about his NBA Career etc. 

This is all alleged and was made public by other people, this is all satire and does not make me money. 

This is again ALL SATIRE and ALLEGED. 

I also DO NOT PROFIT off of this and its all for entertainment purposes only.",527
1r7paqi,images_jpg/1r7paqi.jpg,https://preview.redd.it/1enyenavo5kg1.jpeg?auto=webp&s=a27b545633e3158c7060cbad5ca85545844a0b6a,"KEVIN NEEDS TO LEAVE MY SON ALONE
Kevin has been downgraded to lying hips territory for this one.

He’s 22 LEAVE BRITNEY ALONE AND JUST LET HIM COOK",528
1r76gs1,images_jpg/1r76gs1.jpg,https://external-preview.redd.it/NTJnd3UzNzM3MmtnMUCWomUZ9MK8yNsoLAEyR0tuKAzppm0QgentR31DU8w4.png?format=pjpg&auto=webp&s=a02ccc3a4ddd97f2b460ef99dc86afe2c62311ec,Peak Harden hate era had to been the funniest era in the NBA,529
1r6d87d,images_jpg/1r6d87d.jpg,https://preview.redd.it/um3tlzdtovjg1.jpeg?auto=webp&s=363b94625b4550ea8e10da8067bf27b0819208e4,😂😂,530
1r7g3ay,images_jpg/1r7g3ay.jpg,https://preview.redd.it/8t7q7kflw3kg1.jpeg?auto=webp&s=4a0e95631016782bd363d65a2be9c51bed168a6e,He lowkey just there,531
1r6sfr0,images_jpg/1r6sfr0.jpg,https://external-preview.redd.it/NW9ndHRoMW5qeWpnMfNnqwQuES5frGvPKMf7iUcXINR99-KFU-FAKuLIz2S2.png?format=pjpg&auto=webp&s=93f30e4a40f52cb270ae76b8eee19dce2e637273,Kevin Durant was shook at the All Star Game,532
1r6s351,images_jpg/1r6s351.jpg,https://external-preview.redd.it/NTNjaThmZnRneWpnMdbyZrzbmxzdB6WNwAW88wtaXH0_jA_D4uVAw8_ZhfR2.png?format=pjpg&auto=webp&s=8357a9de35e05833a99da98c0d4a7d22055a389f,AirPodz,533
1r7jv1w,images_jpg/1r7jv1w.jpg,https://preview.redd.it/dmuyfpywj4kg1.jpeg?auto=webp&s=5f55b0d445afb357b93917c8a36e1a82b1182e14,CCTV footage from the Houston Rockets Training Center,534
1r867rx,images_jpg/1r867rx.jpg,https://preview.redd.it/q9i7tj9yv9kg1.jpeg?auto=webp&s=1a70c7f8a171534df7685c7505677c78237329d6,I was scrolling and wondering if those photos are real😭,535
1r6ot4s,images_jpg/1r6ot4s.jpg,https://preview.redd.it/4g9vmqjbsxjg1.png?auto=webp&s=f534ae1f23a467358c2eaa2cb667ad91d32f757f,New player,536
1r6ou3n,images_jpg/1r6ou3n.jpg,https://preview.redd.it/vblqpktfsxjg1.jpeg?auto=webp&s=7c42ed9b7b829936a4f62c8eced0a6a340d93f87,"""NBA is dead in USA its only popular Globally now""
While NBA is way more popular globally than USA and has higher viewership globally than USA (cause of population difference obviously) NBA in USA is doing just fine.

[](https://www.reddit.com/submit/?source_id=t3_1r6otgn)",537
1r6iu3h,images_jpg/1r6iu3h.jpg,https://preview.redd.it/x7yqjx4howjg1.jpeg?auto=webp&s=feb6eec72bc15ef4df317d3f9737484e8c924648,Keshad Johnson has been banned from future dunk contests for dancing too much,538
1r6sqhr,images_jpg/1r6sqhr.jpg,https://preview.redd.it/zni4bykzlyjg1.jpeg?auto=webp&s=de979bdbf3ba933e4f066bec1f4deea8fd142c87,Day one without no NBA basketball to watch 😭,539
1r879ff,images_jpg/1r879ff.jpg,https://external-preview.redd.it/azRxYWdpNXAyYWtnMYlQ0HDZgQYu7iq4X3QgMjgZ-upDn5xwW_-C-OwOwYQ8.png?format=pjpg&auto=webp&s=7afed3e22c4d8f53dc78117f4ff1bc2eabcf2309,"""Kyrie has no handles""",540
1r6i3r3,images_jpg/1r6i3r3.jpg,https://preview.redd.it/v9h6kq9ujwjg1.jpeg?auto=webp&s=b8989cf6b7f608c3d843f2d89caa777d6f82250f,This man really just hates international superstars of all sports huh,541
1r65wu2,images_jpg/1r65wu2.jpg,https://external-preview.redd.it/6Rd172VH08OZ-lQLSnkdxuSgGCj1_jxMaGuZ3WtBe28.jpeg?auto=webp&s=d490d95acd2ee87bab15eb22759a2a483a4a7692,"Cade Cunningham asked where he gets his aura: 
“I get my aura from Jesus Christ and my lord and savior, and God blessed me with parents who raised me in a way I wouldn’t trade for the world.”",542
1r63eyx,images_jpg/1r63eyx.jpg,https://external-preview.redd.it/amg1ZHQyazI5dGpnMYgNDUTgL3XEh6jcj7MryLwIxdRdy1YZpx_y1MPSF5eA.png?format=pjpg&auto=webp&s=724adf15c14dcf17b264432c464042a0d0caf77b,KDF Files Highlights,543
1r5s722,images_jpg/1r5s722.jpg,https://preview.redd.it/jieu5ydajqjg1.jpeg?auto=webp&s=25e825e9146ce41b7c4930ae6dd45319dfaa3a28,Funniest image from the KDF files by far,544
1r5vfqh,images_jpg/1r5vfqh.jpg,https://preview.redd.it/isg0lypn8rjg1.png?auto=webp&s=511ae1da9f140d1009c20ad2824636d2db3898dd,"Pictured: Former U.S. President, Barack Obama with former Soviet Union leader Joseph Stalin at the 2026 NBA All-Star Game.",545
1r6f0bf,images_jpg/1r6f0bf.jpg,https://preview.redd.it/7yzu00ka0wjg1.jpeg?auto=webp&s=59044c710ccf7880aa3e74d990afa2fb31545a27,Rajon Rainbow,546
1r5vkzk,images_jpg/1r5vkzk.jpg,https://preview.redd.it/ictegasv9rjg1.jpeg?auto=webp&s=945201274780b9803c4474fcd9a12a179270839b,Jaylen brown with the step back three,547
1r6c041,images_jpg/1r6c041.jpg,https://preview.redd.it/wsswhy4lgvjg1.png?auto=webp&s=ad73a03bdc2625477159ecb0b3fd679e591e31f3,And they thought was a waste of time to watch Naruto.,548
1r65b53,images_jpg/1r65b53.jpg,https://preview.redd.it/6188nn5zttjg1.jpeg?auto=webp&s=2d5076a15d07230ee485afa205b73aa5718ce0c1,What are President Obama and Dr J discussing here?,549
1r5xunp,images_jpg/1r5xunp.jpg,https://external-preview.redd.it/MGM1bzZua3pzcmpnMV_ip0-M5JU2qok2wRTMm8BWqIaScvIYgl-1cKVDduJ3.png?format=pjpg&auto=webp&s=5f528c47e0bcc57958f36c05d7dde772b2ff90e9,Ant brutally leaves Chet hanging,550
1r5rjg0,images_jpg/1r5rjg0.jpg,https://preview.redd.it/zu0tvfxieqjg1.jpeg?auto=webp&s=bde1250b0524b5a7282487931dad36b5493578f7,Lol 🤣😂,551
1r6cdz1,images_jpg/1r6cdz1.jpg,https://preview.redd.it/8skfvzc9jvjg1.jpeg?auto=webp&s=6cc96175fb4490c3b3a525c594cdb64b6fccb0da,"KD,”Life’s a fucking funny thing”",552
1r66vtb,images_jpg/1r66vtb.jpg,https://preview.redd.it/75k78duqaujg1.jpeg?auto=webp&s=dfcea22a26966429133566d7177c6be3c0ab3f7b,What they were really discussing...,553
1r5zo20,images_jpg/1r5zo20.jpg,https://preview.redd.it/tawzuaet8sjg1.jpeg?auto=webp&s=6d6ed3aa032f5601e9343dcfc435dc31894d6a92,"KD FILES
Legendary. NBA twitter is going insane. This day gonna go down in history as one of the funniest things to happen to the league 😭😭",554
1r5ya8t,images_jpg/1r5ya8t.jpg,https://preview.redd.it/glgxj7mlwrjg1.png?auto=webp&s=21519d8e02726caa20e214093926b04461bc9af4,Sengun and KD talking about the tweets,555
1r578jt,images_jpg/1r578jt.jpg,https://preview.redd.it/n8tqhoeqnljg1.jpeg?auto=webp&s=b1746c93d44e4d7a041d70fa446c5f2d24d29edb,I'm taking this 5 over anyone in any era,556
1r5tpfj,images_jpg/1r5tpfj.jpg,https://preview.redd.it/4e54pf5ruqjg1.gif?format=png8&s=579c0476199d3919fd155ebacb59f8c0890f238d,"KD seeing himself getting exposed
He def friends with deni the way he hawking IDF drones",557
1r5u7ht,images_jpg/1r5u7ht.jpg,https://preview.redd.it/etf94dvtyqjg1.jpeg?auto=webp&s=9aedacb0511cb85670c26b0c43d7ff9df2fa4c4e,Live look at Kawhi after scoring 11 straight points for Team Stripes,558
1r5s49c,images_jpg/1r5s49c.jpg,https://preview.redd.it/gx38nnsoiqjg1.jpeg?auto=webp&s=d77d09bde264c3928d3ea1591c865dd96f63ef95,KD the funniest athlete lmaoooo,559
1r5m7ev,images_jpg/1r5m7ev.jpg,https://preview.redd.it/tbglszczcpjg1.jpeg?auto=webp&s=dcc99a053d6aebe7da298ac186140d7196b31328,"Lakers and Ny Knicks in the future: Cooper Flagg, Luka Doncic, Aj Dybantsa, Giannis, Wemby, Other team Brunson, Mitchell, Bronny James, Sengun, Jokic",560
1r5hv1s,images_jpg/1r5hv1s.jpg,https://external-preview.redd.it/bno4NGp2M3Zpb2pnMafGviq3NYlUa_FvPkw1Yk0VuF--fsCFv2fB_cGBxptk.png?format=pjpg&auto=webp&s=54e093a82bd01e37b52ee858b21c95e89a5e5b0e,"“Get rid of the NBA draft”
I never thought I’d see the day where someone makes Kendrick Perkins sound smart… WTF is this take? They really just let anyone become an “analyst” these days.",561
1r60a12,images_jpg/1r60a12.jpg,https://preview.redd.it/yww7qtm8esjg1.jpeg?auto=webp&s=4965d93ff5883338b2c39ccd6a846ed25dbe7d53,Tari Eason in the locker room after KD files drop:,562
1r5s12c,images_jpg/1r5s12c.jpg,https://preview.redd.it/onpnwgo2iqjg1.jpeg?auto=webp&s=74e0c6308af9df22c5a6cf1bb69d8a50642fbd7d,"Luka hates Dallas organization
After that Lakers-Mavs trade last year, Luka really hates the organization but Dallas fans will always have a special place in Luka’s heart. He hates Nico and Jason Kidd, btw.",563
1r5w8ai,images_jpg/1r5w8ai.jpg,https://preview.redd.it/91ca59pafrjg1.jpeg?auto=webp&s=368eff0dc629714393b98d1c89d8adad039e67f8,"The KD Files now have a helpful database.
Very helpful, will poke around later see if any interesting names pop up. Tried searching harden and a lot came up.",564
1r4ym75,images_jpg/1r4ym75.jpg,https://preview.redd.it/l1syylcdjjjg1.jpeg?auto=webp&s=8d9877450a5274567541af5058e1dc545f5627dc,Haters got KD fighting for his life,565
1r4v4kg,images_jpg/1r4v4kg.jpg,https://preview.redd.it/b8q4bx52tijg1.jpeg?auto=webp&s=a461fd79651b2076d68850a8aaee0de2f46181a5,"If ""is not over until I win"" was a person 😳",566
1r4v14e,images_jpg/1r4v14e.jpg,https://preview.redd.it/zruz7stbsijg1.jpeg?auto=webp&s=4979616bfd3691f85b0a12846b83b6b7841fdd5d,Very likely to happen that an American NBA MVP wont be seen in the 2020s decade.,567
1r51qt3,images_jpg/1r51qt3.jpg,https://preview.redd.it/q30e6j499kjg1.jpeg?auto=webp&s=6ff85b7eda95fd82210d3b09d858478035733830,The dunk contest went downhill after that year,568
1r6advv,images_jpg/1r6advv.jpg,https://preview.redd.it/kofefyz15vjg1.jpeg?auto=webp&s=6d0b1caaf4daae7f30e92064d33de8f5b9a50c15,Tired: imagining abnormally large people in Olympic gymnastics. Wired: imagining abnormally large people in Olympic bobsled,569
1r567ql,images_jpg/1r567ql.jpg,https://preview.redd.it/apoimauaeljg1.jpeg?auto=webp&s=101cfc0f3fcbe729d3c789d295ebec6143b9cb2d,"Congrats to the GOAT PG of all time (not counting Isiah Thomas, Nash, Luka, SGA, Magic, Oscar Robertson, Kyrie or Steph)",570
1r54e0w,images_jpg/1r54e0w.jpg,https://preview.redd.it/bt7fbnamwkjg1.png?auto=webp&s=35cead2c7675137a93a7652ed2862bc8470391b0,MNBA players when they're asked to not sit out of the imaginary ball game they get paid $50 million a year to play,571
1r4opjo,images_jpg/1r4opjo.jpg,https://preview.redd.it/34avudgvjhjg1.jpeg?auto=webp&s=e72115aeefa7e360c0efabd797cee4953f019aea,lol,572
1r4prbu,images_jpg/1r4prbu.jpg,https://external-preview.redd.it/dnh1bXI4bnVxaGpnMVxXgFpxhX31ZWBZ0Sxgu0lqVdwP0si1BbO-g7PivT5a.png?format=pjpg&auto=webp&s=a9bb5ef4948613c65c1cbd1b586e082f55253ad9,What could possibly be this funny? Never seen Draymond laugh like this 🤣,573
1r49j8f,images_jpg/1r49j8f.jpg,https://preview.redd.it/jjngghn4ndjg1.jpeg?auto=webp&s=69315e6ed30f06b1184efd1efdef13cff6a552ad,"Heat, Bulls and Hawks fans watching the Hornets try to ruin their annual play-in invitational",574
1r4t0uf,images_jpg/1r4t0uf.jpg,https://preview.redd.it/l8w6jruydijg1.jpeg?auto=webp&s=3a0d04bfd9639f2fa81896bdde0e4f8de8b2dc76,VJ Afrocombe wins Rising Stars MVP,575
1r49gj2,images_jpg/1r49gj2.jpg,https://external-preview.redd.it/YW5vNTZ2eWxtZGpnMZ8KpqnaddsA1quXV9JUBGq0lacIBG4voFuVNf9KZcf_.png?format=pjpg&auto=webp&s=8a634707143c482319ee64e62816273015444efb,Yoooo,576
1r4329e,images_jpg/1r4329e.jpg,https://preview.redd.it/hgiee9tm7cjg1.jpeg?auto=webp&s=b6bb3db5f45f1c883f4a34226978932fbce23907,When does this simulation arc end?,577
1r3w8sg,images_jpg/1r3w8sg.jpg,https://preview.redd.it/lyfdf6z1xajg1.jpeg?auto=webp&s=262785204aed25c148720de9e95186281b48a7dc,Some insane graphics by the blazers,578
1r4bk93,images_jpg/1r4bk93.jpg,https://preview.redd.it/3u7dqlo15ejg1.png?auto=webp&s=273cb1f80e70b0ae38bc93777bbb1fd685f7e3f4,"Is Adam Silver a hairless cat?
No disrespect intended. I am genuinely wondering if Adam Silver is a human being or a hairless cat?",579
1r3uu0j,images_jpg/1r3uu0j.jpg,https://preview.redd.it/yopu293fnajg1.png?auto=webp&s=81f6fe47f22ffa947c9c792c9efbb669d230053b,"Adam Silver: ""To decide which cities get expansion, we will have a tournament between all the cities that don’t have a team. Because this could all be solved with a tournament. Best tournament to win the tournament becomes THE tournament.""",580
1r3v3si,images_jpg/1r3v3si.jpg,https://external-preview.redd.it/MHdpejBucWdwYWpnMcAZBAm3cobeTlOfRnYIvNpQ2Lg2s2G4kJnTg8IvKIms.png?format=pjpg&auto=webp&s=a9b4868f0171ec85653cd7c50fc4da8ec7d24c77,"""Bro, you had one job!""",581
1r49r4a,images_jpg/1r49r4a.jpg,https://preview.redd.it/yxg7asx1pdjg1.png?auto=webp&s=78a0624a73d21598172f5e5e647746242dcc8f78,yo trust me bro I promise this is the REAL tanking solution,582
1r3mw6s,images_jpg/1r3mw6s.jpg,https://external-preview.redd.it/aGlxajdqb2kwOWpnMYuCW3wQcfwwofVusdA-tAfQO3dw29oY-DyTvauIexWN.png?format=pjpg&auto=webp&s=875dcdf6162ce939b6b2b23e163d0aefbedf6391,Sengun 3 point flop practice,583
1r3ytsk,images_jpg/1r3ytsk.jpg,https://preview.redd.it/drlhb673ebjg1.png?auto=webp&s=831c2eadadd998b53c60821324f034522ac09d68,Shams knows how to break trade news. Let’s see if he can break ankles!,584
1r4pp4c,images_jpg/1r4pp4c.jpg,https://preview.redd.it/pd5miq7uqhjg1.jpeg?auto=webp&s=cda158552d0ee1017fec6cb0c6981fc709e5aa2a,Hear me out: This will solve tanking.,585
1r32vv7,images_jpg/1r32vv7.jpg,https://preview.redd.it/z0f1nt7i74jg1.jpeg?auto=webp&s=59e322e96857423b6449ffe1d27ea390ae59e347,This is some shit you’d see from a YouTuber talking about their 2k MyCareer,586
1r2zepy,images_jpg/1r2zepy.jpg,https://external-preview.redd.it/am83bTVrYTFsM2pnMV6-HslzDwF68BuPTENyL6snOWvBB2sgsQtOh4A-UaCf.png?format=pjpg&auto=webp&s=03225e493913da63bdac3d91863d12ed722b1e1a,Guarding SGA be like,587
1r3ygxj,images_jpg/1r3ygxj.jpg,https://preview.redd.it/gnnxyrirbbjg1.png?auto=webp&s=1f381d2d64aa1931c1f3b27017b045a49cfb5972,You could always count on him to make the right call when it's time had passed.,588
1r3qrnj,images_jpg/1r3qrnj.jpg,https://preview.redd.it/vczvoyzew9jg1.jpeg?auto=webp&s=cd6c861b88e293845295b4bbc843fead31c57471,"LeBron has Draftkings. Giannis has Kalshi. James Harden has.. some mid-tier sweepstakes casino
These guys will get their money any way that they can. z Shout out to his agent for even finding the opportunity. I doubt he's making any significant difference for the site.",589
1r37ftu,images_jpg/1r37ftu.jpg,https://preview.redd.it/8v1b6rkv25jg1.jpeg?auto=webp&s=a1fd53526719b46011c9f6c65dbdbee7f46cfbc6,Zaccharie Risacher last 6 games: 6.7 PPG on 36/30/20 splits (42.4 TS%).,590
1r2ritp,images_jpg/1r2ritp.jpg,https://preview.redd.it/d7diya66z1jg1.jpeg?auto=webp&s=5af4a51588076ca82a0ef468ee909e63c5750613,giannis when he realises he can bet on staying with the bucks in kalshi,591
1r3cxjq,images_jpg/1r3cxjq.jpg,https://preview.redd.it/j2u3umj396jg1.gif?format=png8&s=fd938dc52bc4bd78d0687cf3ed35b1e1703f9e91,Got one..,592
1r3goni,images_jpg/1r3goni.jpg,https://preview.redd.it/fopiqqam57jg1.jpeg?auto=webp&s=a2e7f6ab8ec85867e9eafc5f735862b14ad4143e,"Imagine my surprise seeing this
I did not know about the Trade, and I thought Yeah this is a clear indication how NBA is outright supporting the Thunder.",593
1r30907,images_jpg/1r30907.jpg,https://preview.redd.it/d8ispw0lq3jg1.png?auto=webp&s=2de6d55df357e82c9a29490201747a041c6270e2,"Say NO! To the ""Classy"" Wife Beater Narrative Double Standard! ✊🐝🤜",594
1r3rgvi,images_jpg/1r3rgvi.jpg,https://preview.redd.it/f5gypry51ajg1.jpeg?auto=webp&s=8427ff42e06d55804819ddd0f31f9275d61331fe,Reminder that Pic Related is why we can no longer have competitive All Star games and why they had to change the format in the first place.,595
1r22q6r,images_jpg/1r22q6r.jpg,https://preview.redd.it/lth9k96jbwig1.png?auto=webp&s=f7e8c3d2500fab5de54786675093a4ab9ecea70a,Throwback when Kyrie had to do side missions just to play Basketball 😭,596
1r2r55j,images_jpg/1r2r55j.jpg,https://preview.redd.it/xdv4mvglv1jg1.jpeg?auto=webp&s=534333c31adc2ac8e1e052b3a30ac14a6f472610,Russel,597
1r24uzx,images_jpg/1r24uzx.jpg,https://external-preview.redd.it/MXg3aHl4MDVwd2lnMckuNwV6-zJX_lsosnrS31h5LQPE7ADzYiWChANXFdbi.png?format=pjpg&auto=webp&s=eed7089ed6f685c6960c31cc702397b73b3f8dfe,"Bro jumped OVER the ball, turned around like a tutorial NPC, then pointed at it like 👉🏀 'you get it' 😅",598
1r24mjn,images_jpg/1r24mjn.jpg,https://external-preview.redd.it/b3Z5Z2V4OW9ud2lnMf0cHMyGfbH0MGrJVLm4hDkKXHU_NLSeJeR8ACzQJJiC.png?format=pjpg&auto=webp&s=7c884a2dc17623d4ea5e6baab544583af2434d23,"""When I tell em I got that dog in me in mid sentence, you gon hear me"" - Perk",599
1r1zt04,images_jpg/1r1zt04.jpg,https://preview.redd.it/5bc7zam3qvig1.png?auto=webp&s=de6d1e40fed69869408b60b3896822422402bafd,Who would you pick?,600
1r2ck0y,images_jpg/1r2ck0y.jpg,https://preview.redd.it/q32uoglc4yig1.jpeg?auto=webp&s=690b70faf9065da543564d0b9f9807786f3d535e,Tanking,601
1r2i9o7,images_jpg/1r2i9o7.jpg,https://preview.redd.it/x0wuqk6tczig1.png?auto=webp&s=b5af3ccddc523918cb41df879cf9669612654720,"Have Never Seen Something Like This, Lol",602
1r1m30c,images_jpg/1r1m30c.jpg,https://preview.redd.it/jg0p2oa89sig1.jpeg?auto=webp&s=28df1f7f395bc0f728d4e811253ee4bf1abd0139,"Bro predicted 6 years ago 💀💀
I was scrolling through \*cough cough\* for nba 2k play throughs obviously, when I found this random comment prediction the AD trade 6 years ago. Nah this man is a visionary who's seen the future , somebody find him 💀💀",603
